A2: Vecuma grupa (līdz 2006.dz.g.)
A3: Vieta | B3: Dalībnieks | C3: Pārstāv | D3: Dz.g. | E3: Punkti 1.p. | F3: Punkti 2.p. | G3: Punkti 3.p. | H3: Kopv.
A4: 1 | B4: Esītis Markuss | D4: 2006 | E4: 10 | F4: 8 | G4: 10 | H4: =SUM(E4:G4) -> 28
A5: 2 | B5: Krāmēns Ralfs | D5: 2006 | E5: 8 | F5: 10 | G5: 5 | H5: =SUM(E5:G5) -> 23
A6: 3 | B6: Radziņš Rihards | D6: 2006 | E6: 5 | F6: 4 | G6: 6 | H6: =SUM(E6:G6) -> 15
A7: 4 | B7: Timermanis Edgars | C7: 4 sekundes | D7: 2006 | E7: 6 | G7: 8 | H7: =SUM(E7:G7) -> 14
A8: 5 | B8: Selga Elēna | D8: 2006 | E8: 3 | F8: 6 | G8: 1 | H8: =SUM(E8:G8) -> 10
A9: 6 | B9: Krampe Emīls | C9: LAK 4 | D9: 2007 | E9: 4 | F9: 3 | G9: 3 | H9: =SUM(E9:G9) -> 10
A10: 7 | B10: Bēcis Artūrs | D10: 2008 | F10: 5 | H10: =SUM(E10:G10) -> 5
A11: 8 | B11: Markss Kristians | C11: Smiltene | D11: 2006 | F11: 1 | G11: 4 | H11: =SUM(E11:G11) -> 5
A12: 9 | B12: Sakalausks Rauls Kristers | D12: 2006 | F12: 2 | H12: =SUM(E12:G12) -> 2
A13: 10 | B13: Viļkins Gusts | D13: 2006 | E13: 2 | H13: =SUM(E13:G13) -> 2
A14: 11 | B14: Brēde Bruno | D14: 2007 | E14: 1 | H14: =SUM(E14:G14) -> 1
A15: 12 | B15: Krasts Gustavs | D15: 2006 | G15: 1 | H15: =SUM(E15:G15) -> 1
A17: Vecuma grupa (2005.dz.g.)
A18: Vieta | B18: Dalībnieks | C18: Pārstāv | D18: Dz.g. | E18: Punkti 1.p. | F18: Punkti 2.p. | G18: Punkti 3.p. | H18: Kopv.
A19: 1 | B19: Ratnieks Krišjānis | C19: Riteņu vasara | D19: 2005 | E19: 10 | F19: 6 | G19: 10 | H19: =SUM(E19:G19) -> 26
A20: 2 | B20: Vanags Ralfs Eduards | C20: Valmiera | D20: 2005 | E20: 8 | F20: 10 | G20: 8 | H20: =SUM(E20:G20) -> 26
A21: 3 | B21: Špērs Pēteris | C21: Rīga | D21: 2005 | E21: 6 | F21: 8 | G21: 6 | H21: =SUM(E21:G21) -> 20
A22: 4 | B22: Mušperts Tomass Arnolds | D22: 2005 | E22: 5 | F22: 4 | H22: =SUM(E22:G22) -> 9
A23: 5 | B23: Pasters Kārlis | D23: 2005 | E23: 4 | F23: 3 | H23: =SUM(E23:G23) -> 7
A24: 6 | B24: Stepāns Emīls | D24: 2005 | G24: 5 | H24: =SUM(E24:G24) -> 5
A25: 7 | B25: Brūveris Alekss | D25: 2005 | F25: 5 | H25: =SUM(E25:G25) -> 5
A26: 8 | B26: Zuza Daniels | D26: 2005 | E26: 3 | F26: 1 | H26: =SUM(E26:G26) -> 4
A27: 9 | B27: Stepāns Klāvs | D27: 2005 | G27: 4 | H27: =SUM(E27:G27) -> 4
A28: 10 | B28: Binovskis Krišjānis | D28: 2005 | G28: 3 | H28: =SUM(E28:G28) -> 3
A29: 11 | B29: Rupeks Rupeiks Kristaps | D29: 2005 | F29: 2 | H29: =SUM(E29:G29) -> 2
A30: 12 | B30: Lošins Ričards | D30: 2005 | G30: 2 | H30: =SUM(E30:G30) -> 2
A31: 13 | B31: Kursīte Madara | D31: 2005 | E31: 2 | H31: =SUM(E31:G31) -> 2
A32: 14 | B32: Rusmanis Martins Eduards | D32: 2005 | E32: 1 | H32: =SUM(E32:G32) -> 1
A33: 15 | B33: Roma Anna | D33: 2005 | G33: 1 | H33: =SUM(E33:G33) -> 1
A36: Vecuma grupa (2004.-2003.dz.g.)
A37: Vieta | B37: Dalībnieks | C37: Pārstāv | D37: Dz.g. | E37: Punkti 1.p. | F37: Punkti 2.p. | G37: Punkti 3.p. | H37: Kopv.
A38: 1 | B38: Jonass Marsels Mārcis | D38: 2003 | E38: 10 | F38: 8 | G38: 6 | H38: =SUM(E38:G38) -> 24
A39: 2 | B39: Krampe Bruno | C39: LAK 4 | D39: 2003 | F39: 10 | G39: 10 | H39: =SUM(E39:G39) -> 20
A40: 3 | B40: Avotiņš Artūrs Krišs | C40: Veloserviss | D40: 2003 | E40: 8 | F40: 6 | G40: 3 | H40: =SUM(E40:G40) -> 17
A41: 4 | B41: Krampe Samanta | C41: LAK 4 | D41: 2003 | F41: 5 | G41: 8 | H41: =SUM(E41:G41) -> 13
A42: 5 | B42: Staņko Mārtiņš | C42: Vellapēda/AM furn. | D42: 2004 | E42: 3 | F42: 4 | H42: =SUM(E42:G42) -> 7
A43: 6 | B43: Ustups Toms | E43: 6 | H43: =SUM(E43:G43) -> 6
A44: 7 | B44: Beķeris Bruno | E44: 5 | H44: =SUM(E44:G44) -> 5
A45: 8 | B45: Zīmelis Renārs | D45: 2004 | G45: 5 | H45: =SUM(E45:G45) -> 5
A46: 9 | B46: Kiršteins Ralfs | E46: 4 | H46: =SUM(E46:G46) -> 4
A47: 10 | B47: Bleikš Roberts | C47: Smiltene 4 sek. | D47: 2004 | G47: 4 | H47: =SUM(E47:G47) -> 4
A48: 11 | B48: Pirktiņš Kārlis | D48: 2004 | F48: 3 | H48: =SUM(E48:G48) -> 3
A49: 12 | B49: Spicins Ivan | E49: 2 | H49: =SUM(E49:G49) -> 2
A50: 13 | B50: Kalniņš Ričards | D50: 2004 | F50: 2 | H50: =SUM(E50:G50) -> 2
A51: 14 | B51: Loginovs Matīss | D51: 2003 | G51: 2 | H51: =SUM(E51:G51) -> 2
A52: 15 | B52: Brūveris Ralfs | E52: 1 | H52: =SUM(E52:G52) -> 1
A53: 16 | B53: Džarcāns Emīls | D53: 2004 | F53: 1 | H53: =SUM(E53:G53) -> 1
A54: 17 | B54: Ziedkalns Renārs | D54: 2004 | G54: 1 | H54: =SUM(E54:G54) -> 1
A57: Vecuma grupa (2002.-2001.dz.g.)
A58: Vieta | B58: Dalībnieks | C58: Pārstāv | D58: Dz.g. | E58: Punkti 1.p. | F58: Punkti 2.p. | G58: Punkti 3.p. | H58: Kopv.
A59: 1 | B59: Krasts Alekss | C59: Valmieras Piens | D59: 2001 | E59: 10 | F59: 10 | G59: 10 | H59: =SUM(E59:G59) -> 30
A60: 2 | B60: Tomsons Artūrs | C60: ZZK Cēsis SEB | D60: 2001 | E60: 8 | F60: 8 | G60: 8 | H60: =SUM(E60:G60) -> 24
A61: 3 | B61: Ūdris Artūrs | C61: Valmiera | D61: 2002 | E61: 5 | F61: 6 | G61: 6 | H61: =SUM(E61:G61) -> 17
A62: 4 | B62: Markitāne Elizabete Līna | D62: 2001 | E62: 4 | F62: 4 | G62: 5 | H62: =SUM(E62:G62) -> 13
A63: 5 | B63: Rubenis Pauls | C63: starpsienu centrs | D63: 2001 | E63: 6 | F63: 3 | H63: =SUM(E63:G63) -> 9
A64: 6 | B64: Birkentāls Renārs | D64: 2001 | F64: 5 | G64: 4 | H64: =SUM(E64:G64) -> 9
A65: 7 | B65: Gaiķe Alise | C65: Lielvārde | D65: 2001 | E65: 1 | F65: 2 | G65: 1 | H65: =SUM(E65:G65) -> 4
A66: 8 | B66: Godiņš Arvo | D66: 2002 | E66: 3 | H66: =SUM(E66:G66) -> 3
A67: 9 | B67: Simsons Gusts | C67: MTB Priekuļi | D67: 2002 | G67: 3 | H67: =SUM(E67:G67) -> 3
A68: 10 | B68: Šteinbergs Jānis | C68: Salaspils zīriņi | E68: 2 | H68: =SUM(E68:G68) -> 2
A69: 11 | B69: Zenģis Rūdolfs | D69: 2002 | G69: 2 | H69: =SUM(E69:G69) -> 2
A70: 12 | B70: Balodis Mareks | C70: Virsotne Marmot | D70: 2001 | F70: 1 | H70: =SUM(E70:G70) -> 1
A74: Vecuma grupa (2000.-1999.dz.g.)
A75: Vieta | B75: Dalībnieks | C75: Pārstāv | D75: Dz.g. | E75: Punkti 1.p. | F75: Punkti 2.p. | G75: Punkti 3.p. | H75: Kopv.
A76: 1 | B76: Pētersone Vineta | D76: 1999 | E76: 10 | G76: 10 | H76: =SUM(E76:G76) -> 20
A77: 2 | B77: Rozenfelds Adams Veins | C77: Tandēms | D77: 2000 | E77: 8 | F77: 8 | G77: 4 | H77: =SUM(E77:G77) -> 20
A78: 3 | B78: Vimba Rūdolfs Matīss | C78: Valmiera | D78: 2000 | E78: 6 | G78: 6 | H78: =SUM(E78:G78) -> 12
A79: 4 | B79: Krasts Artūrs | C79: Smiltene | D79: 2000 | F79: 6 | G79: 5 | H79: =SUM(E79:G79) -> 11
A80: 5 | B80: Velps Matīss | C80: 4 sekundes | D80: 1999 | F80: 10 | H80: =SUM(E80:G80) -> 10
A81: 6 | B81: Eliass Martins | C81: Dod ručkā | D81: 2000 | E81: 4 | F81: 3 | G81: 3 | H81: =SUM(E81:G81) -> 10
A82: 7 | B82: Kazaine Alise | D82: 1999 | G82: 8 | H82: =SUM(E82:G82) -> 8
A83: 8 | B83: Ratniece Marta | C83: Riteņu vasara | D83: 2000 | E83: 5 | F83: 1 | H83: =SUM(E83:G83) -> 6
A84: 9 | B84: Šnē Ivo | C84: 4 sekundes | D84: 1999 | F84: 5 | H84: =SUM(E84:G84) -> 5
A85: 10 | B85: Bļizņuks Aleksandrs | C85: RRS Baloži | D85: 1999 | F85: 4 | H85: =SUM(E85:G85) -> 4
A86: 11 | B86: Parijuks Kristiāns | E86: 3 | H86: =SUM(E86:G86) -> 3
A87: 12 | B87: Rūsiņš Kristiāns | C87: Toyota team | D87: 2000 | E87: 2 | H87: =SUM(E87:G87) -> 2
A88: 13 | B88: Iļjenko Mārtiņš Andrejs | C88: Rīgas Teikas vsk. | D88: 2000 | F88: 2 | H88: =SUM(E88:G88) -> 2
A89: 14 | B89: Āre Artis | D89: 2000 | G89: 2 | H89: =SUM(E89:G89) -> 2
A90: 15 | B90: Katena Dagnija | D90: 2000 | E90: 1 | H90: =SUM(E90:G90) -> 1
A91: 16 | B91: Prokofjeva Linda | D91: 2000 | G91: 1 | H91: =SUM(E91:G91) -> 1