A2: Vecuma grupa (līdz 2006.dz.g.)
A3: Vieta | B3: Dalībnieks | C3: Pārstāv | D3: Dz.g. | E3: Punkti 1.p. | F3: Punkti 2.p. | G3: Punkti 3.p. | H3: Punkti 4.p. | I3: Kopv.
A4: 1 | B4: Esītis Markuss | D4: 2006 | E4: 10 | F4: 8 | G4: 10 | H4: 8 | I4: =SUM(E4:H4) -> 36
A5: 2 | B5: Krāmēns Ralfs | D5: 2006 | E5: 8 | F5: 10 | G5: 5 | H5: 10 | I5: =SUM(E5:H5) -> 33
A6: 3 | B6: Radziņš Rihards | D6: 2006 | E6: 5 | F6: 4 | G6: 6 | H6: 6 | I6: =SUM(E6:H6) -> 21
A7: 4 | B7: Timermanis Edgars | C7: 4 sekundes | D7: 2006 | E7: 6 | G7: 8 | I7: =SUM(E7:H7) -> 14
A8: 5 | B8: Selga Elēna | D8: 2006 | E8: 3 | F8: 6 | G8: 1 | H8: 4 | I8: =SUM(E8:H8) -> 14
A9: 6 | B9: Krampe Emīls | C9: LAK 4 | D9: 2007 | E9: 4 | F9: 3 | G9: 3 | I9: =SUM(E9:H9) -> 10
A10: 7 | B10: Bēcis Artūrs | D10: 2008 | F10: 5 | I10: =SUM(E10:H10) -> 5
A11: 8 | B11: Markss Kristians | C11: Smiltene | D11: 2006 | F11: 1 | G11: 4 | I11: =SUM(E11:H11) -> 5
A12: 9 | B12: Zeltiņa Beātrise | D12: 2007 | H12: 5 | I12: =SUM(E12:H12) -> 5
A13: 10 | B13: Sakalausks Rauls Kristers | D13: 2006 | F13: 2 | H13: 2 | I13: =SUM(E13:H13) -> 4
A14: 11 | B14: Ivanovskis Kārlis | D14: 2006 | H14: 3 | I14: =SUM(E14:H14) -> 3
A15: 12 | B15: Viļkins Gusts | D15: 2006 | E15: 2 | I15: =SUM(E15:H15) -> 2
A16: 13 | B16: Brēde Bruno | D16: 2007 | E16: 1 | I16: =SUM(E16:H16) -> 1
A17: 14 | B17: Krasts Gustavs | D17: 2006 | G17: 1 | I17: =SUM(E17:H17) -> 1
A18: 15 | B18: Lukstiņš Pēteris | D18: 2006 | H18: 1 | I18: =SUM(E18:H18) -> 1
A20: Vecuma grupa (2005.dz.g.)
A21: Vieta | B21: Dalībnieks | C21: Pārstāv | D21: Dz.g. | E21: Punkti 1.p. | F21: Punkti 2.p. | G21: Punkti 3.p. | H21: Punkti 4.p. | I21: Kopv.
A22: 1 | B22: Špērs Pēteris | C22: Rīga | D22: 2005 | E22: 6 | F22: 8 | G22: 6 | H22: 8 | I22: =SUM(E22:H22) -> 28
A23: 2 | B23: Vanags Ralfs Eduards | C23: Valmiera | D23: 2005 | E23: 8 | F23: 10 | G23: 8 | H23: 1 | I23: =SUM(E23:H23) -> 27
A24: 3 | B24: Ratnieks Krišjānis | C24: Riteņu vasara | D24: 2005 | E24: 10 | F24: 6 | G24: 10 | I24: =SUM(E24:H24) -> 26
A25: 4 | B25: Zeidaks Kārlis | C25: Riteņu vasara | D25: 2005 | H25: 10 | I25: =SUM(E25:H25) -> 10
A26: 5 | B26: Mušperts Tomass Arnolds | D26: 2005 | E26: 5 | F26: 4 | I26: =SUM(E26:H26) -> 9
A27: 6 | B27: Stepāns Emīls | D27: 2005 | G27: 5 | H27: 4 | I27: =SUM(E27:H27) -> 9
A28: 7 | B28: Pasters Kārlis | D28: 2005 | E28: 4 | F28: 3 | I28: =SUM(E28:H28) -> 7
A29: 8 | B29: Stepāns Klāvs | D29: 2005 | G29: 4 | H29: 2 | I29: =SUM(E29:H29) -> 6
A30: 9 | B30: Binovskis Krišjānis | D30: 2005 | G30: 3 | H30: 3 | I30: =SUM(E30:H30) -> 6
A31: 10 | B31: Broks Markuss | C31: Noķer ja vari | D31: 2005 | H31: 6 | I31: =SUM(E31:H31) -> 6
A32: 11 | B32: Brūveris Alekss | D32: 2005 | F32: 5 | I32: =SUM(E32:H32) -> 5
A33: 12 | B33: Ivanovskis Emīls | D33: 2005 | H33: 5 | I33: =SUM(E33:H33) -> 5
A34: 13 | B34: Zuza Daniels | D34: 2005 | E34: 3 | F34: 1 | I34: =SUM(E34:H34) -> 4
A35: 14 | B35: Rupeks Rupeiks Kristaps | D35: 2005 | F35: 2 | I35: =SUM(E35:H35) -> 2
A36: 15 | B36: Lošins Ričards | D36: 2005 | G36: 2 | I36: =SUM(E36:H36) -> 2
A37: 16 | B37: Kursīte Madara | D37: 2005 | E37: 2 | I37: =SUM(E37:H37) -> 2
A38: 17 | B38: Rusmanis Martins Eduards | D38: 2005 | E38: 1 | I38: =SUM(E38:H38) -> 1
A39: 18 | B39: Roma Anna | D39: 2005 | G39: 1 | I39: =SUM(E39:H39) -> 1
A41: Vecuma grupa (2004.-2003.dz.g.)
A42: Vieta | B42: Dalībnieks | C42: Pārstāv | D42: Dz.g. | E42: Punkti 1.p. | F42: Punkti 2.p. | G42: Punkti 3.p. | H42: Punkti 4.p. | I42: Kopv.
A43: 1 | B43: Jonass Marsels Mārcis | D43: 2003 | E43: 10 | F43: 8 | G43: 6 | H43: 8 | I43: =SUM(E43:H43) -> 32
A44: 2 | B44: Krampe Bruno | C44: LAK 4 | D44: 2003 | F44: 10 | G44: 10 | H44: 10 | I44: =SUM(E44:H44) -> 30
A45: 3 | B45: Krampe Samanta | C45: LAK 4 | D45: 2003 | F45: 5 | G45: 8 | H45: 6 | I45: =SUM(E45:H45) -> 19
A46: 4 | B46: Avotiņš Artūrs Krišs | C46: Veloserviss | D46: 2003 | E46: 8 | F46: 6 | G46: 3 | I46: =SUM(E46:H46) -> 17
A47: 5 | B47: Staņko Mārtiņš | C47: Vellapēda/AM furn. | D47: 2004 | E47: 3 | F47: 4 | I47: =SUM(E47:H47) -> 7
A48: 6 | B48: Ustups Toms | E48: 6 | I48: =SUM(E48:H48) -> 6
A49: 7 | B49: Beķeris Bruno | E49: 5 | I49: =SUM(E49:H49) -> 5
A50: 8 | B50: Zīmelis Renārs | D50: 2004 | G50: 5 | I50: =SUM(E50:H50) -> 5
A51: 9 | B51: Kalniņš Ričards | D51: 2004 | F51: 2 | H51: 3 | I51: =SUM(E51:H51) -> 5
A52: 10 | B52: šits Dario | C52: Klondaika | D52: 2004 | H52: 5 | I52: =SUM(E52:H52) -> 5
A53: 11 | B53: Kiršteins Ralfs | E53: 4 | I53: =SUM(E53:H53) -> 4
A54: 12 | B54: Bleikš Roberts | C54: Smiltene 4 sek. | D54: 2004 | G54: 4 | I54: =SUM(E54:H54) -> 4
A55: 13 | B55: Beļajevs Rodrigo | C55: AGL-AUTO | D55: 2004 | H55: 4 | I55: =SUM(E55:H55) -> 4
A56: 14 | B56: Pirktiņš Kārlis | D56: 2004 | F56: 3 | I56: =SUM(E56:H56) -> 3
A57: 15 | B57: Spicins Ivan | E57: 2 | I57: =SUM(E57:H57) -> 2
A58: 16 | B58: Loginovs Matīss | D58: 2003 | G58: 2 | I58: =SUM(E58:H58) -> 2
A59: 17 | B59: Zvingule Agnija Paula | C59: Kuldīga | D59: 2004 | H59: 2 | I59: =SUM(E59:H59) -> 2
A60: 18 | B60: Brūveris Ralfs | E60: 1 | I60: =SUM(E60:H60) -> 1
A61: 19 | B61: Džarcāns Emīls | D61: 2004 | F61: 1 | I61: =SUM(E61:H61) -> 1
A62: 20 | B62: Ziedkalns Renārs | D62: 2004 | G62: 1 | I62: =SUM(E62:H62) -> 1
A63: 21 | B63: Neļķe Ernests | C63: MTB Garkalne | D63: 2003 | H63: 1 | I63: =SUM(E63:H63) -> 1
A65: Vecuma grupa (2002.-2001.dz.g.)
A66: Vieta | B66: Dalībnieks | C66: Pārstāv | D66: Dz.g. | E66: Punkti 1.p. | F66: Punkti 2.p. | G66: Punkti 3.p. | H66: Punkti 4.p. | I66: Kopv.
A67: 1 | B67: Krasts Alekss | C67: Valmieras Piens | D67: 2001 | E67: 10 | F67: 10 | G67: 10 | H67: 10 | I67: =SUM(E67:H67) -> 40
A68: 2 | B68: Tomsons Artūrs | C68: ZZK Cēsis SEB | D68: 2001 | E68: 8 | F68: 8 | G68: 8 | H68: 6 | I68: =SUM(E68:H68) -> 30
A69: 3 | B69: Markitāne Elizabete Līna | D69: 2001 | E69: 4 | F69: 4 | G69: 5 | H69: 8 | I69: =SUM(E69:H69) -> 21
A70: 4 | B70: Ūdris Artūrs | C70: Valmiera | D70: 2002 | E70: 5 | F70: 6 | G70: 6 | I70: =SUM(E70:H70) -> 17
A71: 5 | B71: Rubenis Pauls | C71: starpsienu centrs | D71: 2001 | E71: 6 | F71: 3 | H71: 5 | I71: =SUM(E71:H71) -> 14
A72: 6 | B72: Birkentāls Renārs | D72: 2001 | F72: 5 | G72: 4 | I72: =SUM(E72:H72) -> 9
A73: 7 | B73: Gaiķe Alise | C73: Lielvārde | D73: 2001 | E73: 1 | F73: 2 | G73: 1 | H73: 4 | I73: =SUM(E73:H73) -> 8
A74: 8 | B74: Godiņš Arvo | D74: 2002 | E74: 3 | I74: =SUM(E74:H74) -> 3
A75: 9 | B75: Simsons Gusts | C75: MTB Priekuļi | D75: 2002 | G75: 3 | I75: =SUM(E75:H75) -> 3
A76: 10 | B76: Čukurs Ingars | D76: 2001 | H76: 3 | I76: =SUM(E76:H76) -> 3
A77: 11 | B77: Šteinbergs Jānis | C77: Salaspils zīriņi | E77: 2 | I77: =SUM(E77:H77) -> 2
A78: 12 | B78: Zenģis Rūdolfs | D78: 2002 | G78: 2 | I78: =SUM(E78:H78) -> 2
A79: 13 | B79: Balodis Mareks | C79: Virsotne Marmot | D79: 2001 | F79: 1 | H79: 1 | I79: =SUM(E79:H79) -> 2
A80: 14 | B80: Rudzītis Jēkabs | D80: 2002 | H80: 2 | I80: =SUM(E80:H80) -> 2
A82: Vecuma grupa (2000.-1999.dz.g.)
A83: Vieta | B83: Dalībnieks | C83: Pārstāv | D83: Dz.g. | E83: Punkti 1.p. | F83: Punkti 2.p. | G83: Punkti 3.p. | H83: Punkti 4.p. | I83: Kopv.
A84: 1 | B84: Rozenfelds Adams Veins | C84: Tandēms | D84: 2000 | E84: 8 | F84: 8 | G84: 4 | H84: 8 | I84: =SUM(E84:H84) -> 28
A85: 2 | B85: Pētersone Vineta | D85: 1999 | E85: 10 | G85: 10 | I85: =SUM(E85:H85) -> 20
A86: 3 | B86: Kazaine Alise | D86: 1999 | G86: 8 | H86: 10 | I86: =SUM(E86:H86) -> 18
A87: 4 | B87: Vimba Rūdolfs Matīss | C87: Valmiera | D87: 2000 | E87: 6 | G87: 6 | I87: =SUM(E87:H87) -> 12
A88: 5 | B88: Krasts Artūrs | C88: Smiltene | D88: 2000 | F88: 6 | G88: 5 | I88: =SUM(E88:H88) -> 11
A89: 6 | B89: Ratniece Marta | C89: Riteņu vasara | D89: 2000 | E89: 5 | F89: 1 | H89: 5 | I89: =SUM(E89:H89) -> 11
A90: 7 | B90: Velps Matīss | C90: 4 sekundes | D90: 1999 | F90: 10 | I90: =SUM(E90:H90) -> 10
A91: 8 | B91: Eliass Martins | C91: Dod ručkā | D91: 2000 | E91: 4 | F91: 3 | G91: 3 | I91: =SUM(E91:H91) -> 10
A92: 9 | B92: Rūsiņš Kristiāns | C92: Toyota team | D92: 2000 | E92: 2 | H92: 6 | I92: =SUM(E92:H92) -> 8
A93: 10 | B93: Šnē Ivo | C93: 4 sekundes | D93: 1999 | F93: 5 | I93: =SUM(E93:H93) -> 5
A94: 11 | B94: Bļizņuks Aleksandrs | C94: RRS Baloži | D94: 1999 | F94: 4 | I94: =SUM(E94:H94) -> 4
A95: 12 | B95: Katena Dagnija | D95: 2000 | E95: 1 | H95: 3 | I95: =SUM(E95:H95) -> 4
A96: 13 | B96: Belevičs Jēkabs | D96: 2000 | H96: 4 | I96: =SUM(E96:H96) -> 4
A97: 14 | B97: Parijuks Kristiāns | E97: 3 | I97: =SUM(E97:H97) -> 3
A98: 15 | B98: Prokofjeva Linda | D98: 2000 | G98: 1 | H98: 2 | I98: =SUM(E98:H98) -> 3
A99: 16 | B99: Iļjenko Mārtiņš Andrejs | C99: Rīgas Teikas vsk. | D99: 2000 | F99: 2 | I99: =SUM(E99:H99) -> 2
A100: 17 | B100: Āre Artis | D100: 2000 | G100: 2 | I100: =SUM(E100:H100) -> 2