A1: Latvijas atklātais XCM čempionāts, Cēsis, 21/06/2009
A2: Garums | B2: Grupa | C2: Vieta | D2: Nr | E2: Dalībnieks | F2: Gads | G2: Pārstāv | H2: Laiks | I2: No līdera | J2: kmh | K2: Statuss
A3: 57 km | B3: JUNIORI
C4: 1 | D4: 40 | E4: Matīss Preimanis | F4: 1991 | G4: Rīgas jaunatnes komanda RRS | H4: 8.908564814814815E-2 | J4: 26.6
C5: 2 | D5: 32 | E5: Toms Skujiņš | F5: 1991 | G5: Rīgas jaunatnes komanda RRS | H5: 9.0740740740740747E-2 | I5: =H5-$H$4 -> 1.6550925925925969E-3 | J5: 26.1
C6: 3 | D6: 35 | E6: Armands Bēcis | F6: 1991 | G6: Rīgas jaunatnes komanda RRS | H6: 9.0763888888888894E-2 | I6: =H6-$H$4 -> 1.678240740740744E-3 | J6: 26.1
C7: 4 | D7: 287 | E7: Andžs Flaksis | F7: 1991 | G7: NN-sporta klubs | H7: 9.0763888888888894E-2 | I7: =H7-$H$4 -> 1.678240740740744E-3 | J7: 26.1
C8: 5 | D8: 195 | E8: Jānis Keišs | F8: 1991 | G8: Rīgas jaunatnes komanda RRS | H8: 9.4293981481481479E-2 | I8: =H8-$H$4 -> 5.2083333333333287E-3 | J8: 25.1
C9: 6 | D9: 223 | E9: Deins Klūga | F9: 1992 | G9: Rīgas jaunatnes komanda RRS | H9: 9.5243055555555553E-2 | I9: =H9-$H$4 -> 6.1574074074074031E-3 | J9: 24.9
C10: 7 | D10: 292 | E10: Māris Bodganovičs | F10: 1991 | G10: Tandēms/Drinkme Team | H10: 9.7766203703703702E-2 | I10: =H10-$H$4 -> 8.6805555555555525E-3 | J10: 24.2
C11: 8 | D11: 352 | E11: Arvis Meldrājs | F11: 1992 | G11: NN-Sporta klubs | H11: 9.9131944444444439E-2 | I11: =H11-$H$4 -> 1.0046296296296289E-2 | J11: 23.9
C12: 9 | D12: 48 | E12: Rihards Bartuševičs | F12: 1991 | G12: Rīgas jaunatnes komanda RRS | H12: 9.9965277777777778E-2 | I12: =H12-$H$4 -> 1.0879629629629628E-2 | J12: 23.7
C13: 10 | D13: 170 | E13: Ivars Prokofjevs | F13: 1991 | H13: 0.10168981481481482 | I13: =H13-$H$4 -> 1.2604166666666666E-2 | J13: 23.3
C14: 11 | D14: 338 | E14: Atis Šaicāns | F14: 1991 | H14: 0.10209490740740741 | I14: =H14-$H$4 -> 1.3009259259259262E-2 | J14: 23.2
C15: 12 | D15: 354 | E15: Sergejs Lepers | F15: 1991 | G15: Tandēms/Drinkme Team | H15: 0.10262731481481481 | I15: =H15-$H$4 -> 1.354166666666666E-2 | J15: 23.1
C16: 13 | D16: 288 | E16: Andris Vosekalns | F16: 1992 | G16: NN-sporta klubs | H16: 0.10319444444444445 | I16: =H16-$H$4 -> 1.41087962962963E-2 | J16: 23
C17: 14 | D17: 225 | E17: Aleksandrs Kurbadskis | F17: 1992 | G17: Rīgas jaunatnes komanda RRS | H17: 0.10582175925925925 | I17: =H17-$H$4 -> 1.6736111111111104E-2 | J17: 22.4
C18: 15 | D18: 118 | E18: Jānis Raize | F18: 1991 | G18: Mežmalas MTB | H18: 0.10951388888888888 | I18: =H18-$H$4 -> 2.0428240740740733E-2 | J18: 21.6
C19: 16 | D19: 227 | E19: Henrijs Vimba | F19: 1992 | G19: Valmiera-Ripo autocentrs | H19: 0.11064814814814815 | I19: =H19-$H$4 -> 2.1562499999999998E-2 | J19: 21.4
C20: 17 | D20: 224 | E20: Romāns Bļinovs | F20: 1992 | G20: Rīgas jaunatnes komanda RRS | H20: 0.11896990740740741 | I20: =H20-$H$4 -> 2.9884259259259263E-2 | J20: 19.9
C21: 18 | D21: 290 | E21: Emīls Liepiņš | F21: 1992 | G21: Tandēms/Drinkme Team | H21: 0.12438657407407408 | I21: =H21-$H$4 -> 3.530092592592593E-2 | J21: 19
A22: 57 km | B22: M-ELITE
C23: 1 | D23: 34 | E23: Normunds Zviedris | F23: 1969 | G23: ZZK-Extreme Sport | H23: 8.7164351851851854E-2 | J23: 27.2
C24: 2 | D24: 329 | E24: Herberts Pudāns | F24: 1986 | G24: TREK-PHILIPS | H24: 8.8229166666666664E-2 | I24: =H24-$H$23 -> 1.0648148148148101E-3 | J24: 26.9
C25: 3 | D25: 17 | E25: Dmitrijs Sorokins | F25: 1982 | G25: Rietumu Banka-Rīga | H25: 8.8912037037037039E-2 | I25: =H25-$H$23 -> 1.7476851851851855E-3 | J25: 26.7
C26: 4 | D26: 10 | E26: Gints Jakovels | F26: 1982 | G26: TREK-PHILIPS | H26: 8.8993055555555561E-2 | I26: =H26-$H$23 -> 1.8287037037037074E-3 | J26: 26.6
C27: 5 | D27: 186 | E27: Kalvis Eisaks | F27: 1983 | G27: Rietumu Banka-Rīga | H27: 8.925925925925926E-2 | I27: =H27-$H$23 -> 2.0949074074074064E-3 | J27: 26.6
C28: 6 | D28: 15 | E28: Reinis Andrijanovs | F28: 1988 | G28: NN-Sporta klubs | H28: 8.9861111111111114E-2 | I28: =H28-$H$23 -> 2.6967592592592599E-3 | J28: 26.4
C29: 7 | D29: 9 | E29: Jānis Rezins | F29: 1990 | G29: Rietumu Banka-Rīga | H29: 9.0520833333333328E-2 | I29: =H29-$H$23 -> 3.3564814814814742E-3 | J29: 26.2
C30: 8 | D30: 13 | E30: Ervīns Smoļins | F30: 1987 | G30: NN-Sporta klubs | H30: 9.0624999999999997E-2 | I30: =H30-$H$23 -> 3.4606481481481433E-3 | J30: 26.2
C31: 9 | D31: 31 | E31: Reinis Avens | F31: 1978 | G31: Gandrs-Merida | H31: 9.0833333333333335E-2 | I31: =H31-$H$23 -> 3.6689814814814814E-3 | J31: 26.1
C32: 10 | D32: 21 | E32: Lauris Purniņš | F32: 1986 | G32: TREK-PHILIPS | H32: 9.0844907407407402E-2 | I32: =H32-$H$23 -> 3.680555555555548E-3 | J32: 26.1
C33: 11 | D33: 50 | E33: Ernests Benhens | F33: 1990 | G33: Burusports Team | H33: 9.1701388888888888E-2 | I33: =H33-$H$23 -> 4.5370370370370339E-3 | J33: 25.8
C34: 12 | D34: 11 | E34: Kristofers Rācenājs | F34: 1985 | G34: Rietumu Banka-Rīga | H34: 9.2256944444444447E-2 | I34: =H34-$H$23 -> 5.092592592592593E-3 | J34: 25.7
C35: 13 | D35: 14 | E35: Andris Smirnovs | F35: 1990 | G35: NN-Sporta klubs | H35: 9.2534722222222227E-2 | I35: =H35-$H$23 -> 5.3703703703703726E-3 | J35: 25.6
C36: 14 | D36: 167 | E36: Andris Ponomarenko | F36: 1987 | G36: Gandrs-Merida | H36: 9.2928240740740742E-2 | I36: =H36-$H$23 -> 5.7638888888888878E-3 | J36: 25.5
C37: 15 | D37: 6 | E37: Indulis Bekmanis | F37: 1989 | G37: Rietumu Banka-Rīga-RRS | H37: 9.3402777777777779E-2 | I37: =H37-$H$23 -> 6.238425925925925E-3 | J37: 25.4
C38: 16 | D38: 56 | E38: Dmitrijs Dēliņš | F38: 1980 | G38: NN-Sporta klubs | H38: 9.4317129629629626E-2 | I38: =H38-$H$23 -> 7.1527777777777718E-3 | J38: 25.1
C39: 17 | D39: 18 | E39: Didzis Prauliņš | F39: 1987 | G39: NN-Sporta klubs | H39: 9.4849537037037038E-2 | I39: =H39-$H$23 -> 7.6851851851851838E-3 | J39: 25
C40: 18 | D40: 52 | E40: Toms Flaksis | F40: 1988 | G40: Vides fakti | H40: 9.5011574074074068E-2 | I40: =H40-$H$23 -> 7.8472222222222138E-3 | J40: 24.9
C41: 19 | D41: 160 | E41: Normunds Beika | F41: 1976 | G41: ZZK-Extreme Sport | H41: 9.5023148148148148E-2 | I41: =H41-$H$23 -> 7.8587962962962943E-3 | J41: 24.9
C42: 20 | D42: 42 | E42: Konstantīns Smotrovs | F42: 1985 | G42: Gandrs-Merida | H42: 9.5034722222222229E-2 | I42: =H42-$H$23 -> 7.8703703703703748E-3 | J42: 24.9
C43: 21 | D43: 28 | E43: Valdis Berķis | F43: 1990 | G43: Rietumu Banka-Rīga | H43: 9.7199074074074077E-2 | I43: =H43-$H$23 -> 1.0034722222222223E-2 | J43: 24.4
C44: 22 | D44: 29 | E44: Jānis Kaupe | F44: 1983 | G44: Gandrs-Merida | H44: 9.7210648148148143E-2 | I44: =H44-$H$23 -> 1.0046296296296289E-2 | J44: 24.4
C45: 23 | D45: 281 | E45: Reinis Markss | F45: 1990 | G45: TREK-PHILIPS | H45: 9.7291666666666665E-2 | I45: =H45-$H$23 -> 1.0127314814814811E-2 | J45: 24.4
C46: 24 | D46: 343 | E46: Mārtiņš Trautmanis | F46: 1988 | G46: SOKKIA | H46: 9.734953703703704E-2 | I46: =H46-$H$23 -> 1.0185185185185186E-2 | J46: 24.3
C47: 25 | D47: 60 | E47: Mārcis Pērkons | F47: 1984 | G47: Salaspils/Zīriņi | H47: 9.7581018518518525E-2 | I47: =H47-$H$23 -> 1.0416666666666671E-2 | J47: 24.3
C48: 26 | D48: 30 | E48: Jānis Rubiks | F48: 1989 | G48: Valmiera-Ripo autocentrs | H48: 9.7951388888888893E-2 | I48: =H48-$H$23 -> 1.0787037037037039E-2 | J48: 24.2
C49: 27 | D49: 38 | E49: Raivis Ritums | F49: 1986 | G49: Tandēms/Drinkme Team | H49: 9.8287037037037034E-2 | I49: =H49-$H$23 -> 1.112268518518518E-2 | J49: 24.1
C50: 28 | D50: 55 | E50: Mārtiņš Sārs | F50: 1987 | G50: Mežmalas MTB | H50: 9.8321759259259262E-2 | I50: =H50-$H$23 -> 1.1157407407407408E-2 | J50: 24.1
C51: 29 | D51: 46 | E51: Dmitrijs Andrejevs | F51: 1979 | G51: TREK-PHILIPS | H51: 9.8402777777777783E-2 | I51: =H51-$H$23 -> 1.1238425925925929E-2 | J51: 24.1
C52: 30 | D52: 61 | E52: Kristaps Kipurs | F52: 1983 | G52: Hotel Centra-Velobiķeri.lv | H52: 9.9074074074074078E-2 | I52: =H52-$H$23 -> 1.1909722222222224E-2 | J52: 23.9
C53: 31 | D53: 189 | E53: Kirils Pogodins | F53: 1987 | G53: Burusports Team | H53: 9.9201388888888895E-2 | I53: =H53-$H$23 -> 1.2037037037037041E-2 | J53: 23.9
C54: 32 | D54: 91 | E54: Atis Šteinbergs | F54: 1980 | G54: Valmiera-Ripo autocentrs | H54: 0.10043981481481482 | I54: =H54-$H$23 -> 1.3275462962962961E-2 | J54: 23.6
C55: 33 | D55: 72 | E55: Aigars Kalējs | F55: 1981 | G55: EthicSport SEB Priekuļi 2 | H55: 0.10048611111111111 | I55: =H55-$H$23 -> 1.3321759259259255E-2 | J55: 23.6
C56: 34 | D56: 22 | E56: Toms Knostenbergs | F56: 1990 | G56: TREK-PHILIPS | H56: 0.10159722222222223 | I56: =H56-$H$23 -> 1.4432870370370374E-2 | J56: 23.3
C57: 35 | D57: 57 | E57: Kaspars Ķipurs | F57: 1982 | G57: Hotel Centra-Velobiķeri.lv | H57: 0.1017824074074074 | I57: =H57-$H$23 -> 1.4618055555555551E-2 | J57: 23.3
C58: 36 | D58: 47 | E58: Andris Krūmiņliepa | F58: 1983 | G58: Hotel Centra-Velobiķeri.lv | H58: 0.10248842592592593 | I58: =H58-$H$23 -> 1.5324074074074073E-2 | J58: 23.1
C59: 37 | D59: 191 | E59: Mārtiņš Alksnis | F59: 1975 | G59: Salaspils/Zīriņi | H59: 0.1031712962962963 | I59: =H59-$H$23 -> 1.6006944444444449E-2 | J59: 23
C60: 38 | D60: 103 | E60: Māris Kalveršs | F60: 1976 | G60: Salaspils/Zīriņi | H60: 0.10451388888888889 | I60: =H60-$H$23 -> 1.7349537037037038E-2 | J60: 22.7
C61: 39 | D61: 85 | E61: Mārtiņš Flaksis | F61: 1986 | G61: Vides fakti | H61: 0.10633101851851852 | I61: =H61-$H$23 -> 1.9166666666666665E-2 | J61: 22.3
C62: 40 | D62: 315 | E62: Mārtiņš Lejiņš | F62: 1983 | G62: Burusports Team | H62: 0.10958333333333334 | I62: =H62-$H$23 -> 2.2418981481481484E-2 | J62: 21.6
C63: 41 | D63: 45 | E63: Viesturs Lejiņš | F63: 1978 | G63: Fans Cube Team | H63: 0.11076388888888888 | I63: =H63-$H$23 -> 2.359953703703703E-2 | J63: 21.4
C64: 42 | D64: 131 | E64: Āris Freijs | F64: 1976 | G64: EthicSport SEB Priekuļi 2 | H64: 0.11502314814814815 | I64: =H64-$H$23 -> 2.7858796296296298E-2 | J64: 20.6
C65: 43 | D65: 140 | E65: Edijs Grants | F65: 1985 | G65: Burusports Team | H65: 0.11979166666666667 | I65: =H65-$H$23 -> 3.2627314814814817E-2 | J65: 19.8
C66: 44 | D66: 113 | E66: Ainārs Balodis | F66: 1980 | G66: Nordi | H66: 0.12055555555555555 | I66: =H66-$H$23 -> 3.3391203703703701E-2 | J66: 19.7
C67: 45 | D67: 153 | E67: Mareks Dombrovskis | F67: 1975 | G67: EthicSport SEB Priekuļi 2 | H67: 0.12482638888888889 | I67: =H67-$H$23 -> 3.7662037037037036E-2 | J67: 19
C68: 46 | D68: 200 | E68: Jēkabs Krastiņš | F68: 1975 | H68: 0.12579861111111112 | I68: =H68-$H$23 -> 3.8634259259259271E-2 | J68: 18.8
C69: 47 | D69: 341 | E69: Māris Krūze | F69: 1979 | G69: EthicSport SEB Priekuļi 2 | H69: 0.12633101851851852 | I69: =H69-$H$23 -> 3.9166666666666669E-2 | J69: 18.7
C70: 48 | D70: 217 | E70: Ivo Gruduls | F70: 1988 | G70: Mežmalas MTB | H70: 0.13237268518518519 | I70: =H70-$H$23 -> 4.5208333333333336E-2 | J70: 17.9
C71: 49 | D71: 213 | E71: Mārtiņš Martinsons | F71: 1985 | G71: Gjensidige Baltic | H71: 0.15415509259259258 | I71: =H71-$H$23 -> 6.6990740740740726E-2 | J71: 15.4
C72: 50 | D72: 214 | E72: Mārtiņš Zaharevskis | F72: 1987 | G72: Gjensidige Baltic | H72: 0.14935185185185185 | J72: 15.9 | K72: Ķiv.
A73: 57 km | B73: SENIORES
C74: 1 | D74: 151 | E74: Raivita Birkentāla | F74: 1971 | G74: Raimaks | H74: 0.13250000000000001 | J74: 17.9
A75: 57 km | B75: SENIORI
C76: 1 | D76: 41 | E76: Gunārs Dzalbs | F76: 1971 | G76: Rietumu Banka-Rīga | H76: 9.1805555555555557E-2 | J76: 25.8
C77: 2 | D77: 23 | E77: Aleksandrs Lavišs | F77: 1974 | G77: Gandrs-Merida | H77: 9.2442129629629624E-2 | I77: =H77-$H$76 -> 6.3657407407406719E-4 | J77: 25.6
C78: 3 | D78: 37 | E78: Ints Celmaraugs | F78: 1965 | G78: Gandrs-Merida | H78: 9.2928240740740742E-2 | I78: =H78-$H$76 -> 1.1226851851851849E-3 | J78: 25.5
C79: 4 | D79: 16 | E79: Jānis Rezins | F79: 1962 | G79: ZZK-Extreme Sport | H79: 9.4293981481481479E-2 | I79: =H79-$H$76 -> 2.4884259259259217E-3 | J79: 25.1
C80: 5 | D80: 25 | E80: Mārtiņš Biezais | F80: 1971 | G80: EthicSport SEB Priekuļi 1 | H80: 9.5787037037037032E-2 | I80: =H80-$H$76 -> 3.9814814814814747E-3 | J80: 24.7
C81: 6 | D81: 54 | E81: Aivars Bogdanovs | F81: 1965 | G81: EthicSport SEB Priekuļi 1 | H81: 9.6574074074074076E-2 | I81: =H81-$H$76 -> 4.7685185185185192E-3 | J81: 24.5
C82: 7 | D82: 70 | E82: Jānis Roskošs | F82: 1973 | G82: Smiltene | H82: 9.7407407407407401E-2 | I82: =H82-$H$76 -> 5.601851851851844E-3 | J82: 24.3
C83: 8 | D83: 24 | E83: Ints Reņķis | F83: 1972 | G83: Tandēms/Drinkme Team | H83: 9.8125000000000004E-2 | I83: =H83-$H$76 -> 6.319444444444447E-3 | J83: 24.2
C84: 9 | D84: 26 | E84: Dzintars Osītis | F84: 1968 | G84: EthicSport SEB Priekuļi 1 | H84: 9.8136574074074071E-2 | I84: =H84-$H$76 -> 6.3310185185185136E-3 | J84: 24.2
C85: 10 | D85: 43 | E85: Normunds Šuksts | F85: 1973 | G85: TREK-PHILIPS | H85: 9.8298611111111114E-2 | I85: =H85-$H$76 -> 6.4930555555555575E-3 | J85: 24.1
C86: 11 | D86: 346 | E86: Ainārs Žebers | F86: 1964 | G86: ZZK-Extreme Sport | H86: 9.8599537037037041E-2 | I86: =H86-$H$76 -> 6.7939814814814842E-3 | J86: 24
C87: 12 | D87: 20 | E87: Mareks Birkentāls | F87: 1971 | G87: EthicSport SEB Priekuļi 1 | H87: 9.886574074074074E-2 | I87: =H87-$H$76 -> 7.0601851851851832E-3 | J87: 24
C88: 13 | D88: 229 | E88: Jānis Vimba | F88: 1969 | G88: Valmiera-Ripo autocentrs | H88: 9.9236111111111108E-2 | I88: =H88-$H$76 -> 7.4305555555555514E-3 | J88: 23.9
C89: 14 | D89: 109 | E89: Pāvels Tarasovs | F89: 1970 | G89: Mežmalas MTB | H89: 9.9328703703703697E-2 | I89: =H89-$H$76 -> 7.5231481481481399E-3 | J89: 23.9
C90: 15 | D90: 36 | E90: Raimonds Brokāns | F90: 1973 | G90: NN-Sporta klubs | H90: 0.10085648148148148 | I90: =H90-$H$76 -> 9.0509259259259206E-3 | J90: 23.5
C91: 16 | D91: 51 | E91: Agris Kalējs | F91: 1962 | G91: Hotel Centra-Velobiķeri.lv | H91: 0.10171296296296296 | I91: =H91-$H$76 -> 9.9074074074074064E-3 | J91: 23.3
C92: 17 | D92: 74 | E92: Guntars Ceplītis | F92: 1969 | G92: Valmiera-Ripo autocentrs | H92: 0.10171296296296296 | I92: =H92-$H$76 -> 9.9074074074074064E-3 | J92: 23.3
C93: 18 | D93: 67 | E93: Mareks Marčenkovs | F93: 1970 | G93: Salaspils/Zīriņi | H93: 0.10221064814814815 | I93: =H93-$H$76 -> 1.0405092592592591E-2 | J93: 23.2
C94: 19 | D94: 66 | E94: Juris Sniķis | F94: 1973 | G94: Mežmalas MTB | H94: 0.10282407407407407 | I94: =H94-$H$76 -> 1.1018518518518511E-2 | J94: 23
C95: 20 | D95: 44 | E95: Guntars Baranovskis | F95: 1968 | G95: Smiltene | H95: 0.10395833333333333 | I95: =H95-$H$76 -> 1.2152777777777776E-2 | J95: 22.8
C96: 21 | D96: 163 | E96: Egons Rozenfelds | F96: 1969 | G96: Tandēms/Drinkme Team | H96: 0.10418981481481482 | I96: =H96-$H$76 -> 1.2384259259259262E-2 | J96: 22.7
C97: 22 | D97: 96 | E97: Ainars Ozoliņš | F97: 1960 | G97: Valmiera-Ripo autocentrs | H97: 0.10421296296296297 | I97: =H97-$H$76 -> 1.2407407407407409E-2 | J97: 22.7
C98: 23 | D98: 73 | E98: Aigars Krasts | F98: 1966 | G98: Smiltene | H98: 0.10436342592592593 | I98: =H98-$H$76 -> 1.2557870370370372E-2 | J98: 22.7
C99: 24 | D99: 132 | E99: Jānis Bruzinskis | F99: 1959 | H99: 0.10515046296296296 | I99: =H99-$H$76 -> 1.3344907407407403E-2 | J99: 22.5
C100: 25 | D100: 98 | E100: Guntis Viļums | F100: 1954 | G100: CBM/Smiltene | H100: 0.10582175925925925 | I100: =H100-$H$76 -> 1.4016203703703697E-2 | J100: 22.4
C101: 26 | D101: 27 | E101: Uģis Voiceščuks | F101: 1971 | G101: EthicSport SEB Priekuļi 1 | H101: 0.10664351851851851 | I101: =H101-$H$76 -> 1.4837962962962956E-2 | J101: 22.2
C102: 27 | D102: 76 | E102: Pēteris Plūme | F102: 1972 | G102: Hotel Centra-Velobiķeri.lv | H102: 0.10668981481481482 | I102: =H102-$H$76 -> 1.4884259259259264E-2 | J102: 22.2
C103: 28 | D103: 65 | E103: Leonīds Aleksējevs | F103: 1958 | G103: Fans Cube Team | H103: 0.1070949074074074 | I103: =H103-$H$76 -> 1.5289351851851846E-2 | J103: 22.1
C104: 29 | D104: 63 | E104: Jānis Kleinbergs | F104: 1957 | G104: ZZK-Extreme Sport | H104: 0.10710648148148148 | I104: =H104-$H$76 -> 1.5300925925925926E-2 | J104: 22.1
C105: 30 | D105: 95 | E105: Gints Šķēps | F105: 1971 | G105: Raimaks | H105: 0.10721064814814815 | I105: =H105-$H$76 -> 1.5405092592592595E-2 | J105: 22.1
C106: 31 | D106: 107 | E106: Armands Berķis | F106: 1966 | G106: Burusports Team | H106: 0.10759259259259259 | I106: =H106-$H$76 -> 1.578703703703703E-2 | J106: 22
C107: 32 | D107: 82 | E107: Sergejs Pomarņevskis | F107: 1954 | G107: Hotel Centra-Velobiķeri.lv | H107: 0.10846064814814815 | I107: =H107-$H$76 -> 1.6655092592592596E-2 | J107: 21.8
C108: 33 | D108: 88 | E108: Dzintars Lejiņš | F108: 1973 | G108: Fans Cube Team | H108: 0.11076388888888888 | I108: =H108-$H$76 -> 1.8958333333333327E-2 | J108: 21.4
C109: 34 | D109: 184 | E109: Kalvis Malderis | F109: 1974 | G109: Salaspils/Zīriņi | H109: 0.11127314814814815 | I109: =H109-$H$76 -> 1.9467592592592592E-2 | J109: 21.3
C110: 35 | D110: 100 | E110: Andris Fūrmanis | F110: 1973 | G110: Valmiera-Ripo autocentrs | H110: 0.11135416666666667 | I110: =H110-$H$76 -> 1.9548611111111114E-2 | J110: 21.3
C111: 36 | D111: 97 | E111: Guntis Vinters | F111: 1965 | G111: Tandēms/Drinkme Team | H111: 0.11203703703703703 | I111: =H111-$H$76 -> 2.0231481481481475E-2 | J111: 21.1
C112: 37 | D112: 49 | E112: Aivars Skutelis | F112: 1968 | G112: ZZK-Extreme Sport | H112: 0.11297453703703704 | I112: =H112-$H$76 -> 2.1168981481481483E-2 | J112: 21
C113: 38 | D113: 77 | E113: Andrejs Iļjenko | F113: 1969 | G113: Smiltene | H113: 0.11369212962962963 | I113: =H113-$H$76 -> 2.1886574074074072E-2 | J113: 20.8
C114: 39 | D114: 130 | E114: Arnis Šūlmeisters | F114: 1970 | G114: EthicSport SEB Priekuļi 2 | H114: 0.11375 | I114: =H114-$H$76 -> 2.1944444444444447E-2 | J114: 20.8
C115: 40 | D115: 178 | E115: Arvils Andersons | F115: 1962 | G115: Hotel Centra-Velobiķeri.lv | H115: 0.11407407407407408 | I115: =H115-$H$76 -> 2.2268518518518521E-2 | J115: 20.8
C116: 41 | D116: 183 | E116: Ints Šteinbergs | F116: 1971 | G116: Salaspils/Zīriņi | H116: 0.11494212962962963 | I116: =H116-$H$76 -> 2.3136574074074073E-2 | J116: 20.6
C117: 42 | D117: 139 | E117: Aldis Pundurs | F117: 1965 | G117: Hotel Centra-Velobiķeri.lv | H117: 0.11547453703703704 | I117: =H117-$H$76 -> 2.3668981481481485E-2 | J117: 20.5
C118: 43 | D118: 80 | E118: Jānis Hāze | F118: 1972 | H118: 0.11599537037037037 | I118: =H118-$H$76 -> 2.4189814814814817E-2 | J118: 20.4
C119: 44 | D119: 106 | E119: Sandis Nete | F119: 1972 | G119: EthicSport SEB Priekuļi 2 | H119: 0.1182986111111111 | I119: =H119-$H$76 -> 2.6493055555555547E-2 | J119: 20
C120: 45 | D120: 86 | E120: Māris Fūrmanis | F120: 1971 | G120: Valmiera-Ripo autocentrs | H120: 0.1189236111111111 | I120: =H120-$H$76 -> 2.7118055555555548E-2 | J120: 19.9
C121: 46 | D121: 117 | E121: Edmunds Spigovskis | F121: 1962 | G121: Hotel Centra-Velobiķeri.lv | H121: 0.11945601851851852 | I121: =H121-$H$76 -> 2.765046296296296E-2 | J121: 19.8
C122: 47 | D122: 120 | E122: Juris Kolns | F122: 1970 | G122: Mežmalas MTB | H122: 0.11975694444444444 | I122: =H122-$H$76 -> 2.7951388888888887E-2 | J122: 19.8
C123: 48 | D123: 133 | E123: Romualds Ignatjevs | F123: 1969 | G123: Hotel Centra-Velobiķeri.lv | H123: 0.11979166666666667 | I123: =H123-$H$76 -> 2.7986111111111114E-2 | J123: 19.8
C124: 49 | D124: 148 | E124: Juris Borovikovs | F124: 1970 | G124: Mežmalas MTB | H124: 0.12047453703703703 | I124: =H124-$H$76 -> 2.8668981481481476E-2 | J124: 19.7
C125: 50 | D125: 146 | E125: Ingus Grants | F125: 1962 | G125: Burusports Team | H125: 0.12137731481481481 | I125: =H125-$H$76 -> 2.9571759259259256E-2 | J125: 19.5
C126: 51 | D126: 136 | E126: Nauris Kalniņš | F126: 1970 | H126: 0.123125 | I126: =H126-$H$76 -> 3.1319444444444441E-2 | J126: 19.2
C127: 52 | D127: 127 | E127: Gvido Sabulis | F127: 1970 | G127: EthicSport SEB Priekuļi 2 | H127: 0.124375 | I127: =H127-$H$76 -> 3.2569444444444443E-2 | J127: 19
C128: 53 | D128: 99 | E128: Aigars Eriņš | F128: 1964 | G128: Hotel Centra-Velobiķeri.lv | H128: 0.12656249999999999 | I128: =H128-$H$76 -> 3.4756944444444438E-2 | J128: 18.7
C129: 54 | D129: 78 | E129: Ivars Bērsons | F129: 1971 | G129: Eko Osta | H129: 0.12715277777777778 | I129: =H129-$H$76 -> 3.5347222222222224E-2 | J129: 18.6
C130: 55 | D130: 212 | E130: Jānis Skolnieks | F130: 1972 | G130: Gjensidige Baltic | H130: 0.13106481481481483 | I130: =H130-$H$76 -> 3.9259259259259272E-2 | J130: 18.1
C131: 56 | D131: 165 | E131: Ivars Ozoliņš | F131: 1966 | G131: Vides fakti | H131: 0.13224537037037037 | I131: =H131-$H$76 -> 4.0439814814814817E-2 | J131: 17.9
C132: 57 | D132: 123 | E132: Andris Pommers | F132: 1974 | G132: Salaspils/Zīriņi | H132: 0.13293981481481482 | I132: =H132-$H$76 -> 4.1134259259259259E-2 | J132: 17.8
C133: 58 | D133: 69 | E133: Agnis Apse | F133: 1971 | G133: BH | H133: 0.13325231481481481 | I133: =H133-$H$76 -> 4.1446759259259253E-2 | J133: 17.8
C134: 59 | D134: 161 | E134: Jānis Splīte | F134: 1956 | H134: 0.14237268518518517 | I134: =H134-$H$76 -> 5.0567129629629615E-2 | J134: 16.6
C135: 60 | D135: 169 | E135: Ēriks Melkurts | F135: 1963 | H135: 0.15015046296296297 | I135: =H135-$H$76 -> 5.8344907407407415E-2 | J135: 15.8
C136: 61 | D136: 216 | E136: Jānis Roģis | F136: 1964 | G136: Mežmalas MTB | H136: 0.15119212962962963 | I136: =H136-$H$76 -> 5.9386574074074078E-2 | J136: 15.7
A137: 57 km | B137: W-ELITE
C138: 1 | D138: 71 | E138: Ivanda Eiduka | F138: 1977 | G138: Rietumu Banka-Rīga | H138: 0.10059027777777778 | J138: 23.6
C139: 2 | D139: 197 | E139: Lelde Tipāne | F139: 1985 | G139: TREK-PHILIPS | H139: 0.10644675925925925 | I139: =H139-$H$138 -> 5.8564814814814764E-3 | J139: 22.3
C140: 3 | D140: 349 | E140: Māra Leitāne | F140: 1983 | G140: 4ever/SK Mežaparks | H140: 0.10864583333333333 | I140: =H140-$H$138 -> 8.0555555555555519E-3 | J140: 21.8
C141: 4 | D141: 128 | E141: Anda Savļenko | F141: 1979 | G141: NN-Sporta klubs | H141: 0.1154513888888889 | I141: =H141-$H$138 -> 1.4861111111111117E-2 | J141: 20.5
C142: 5 | D142: 203 | E142: Maija Kvedere | F142: 1980 | G142: FMS | H142: 0.11776620370370371 | I142: =H142-$H$138 -> 1.7175925925925928E-2 | J142: 20.1
C143: 6 | D143: 228 | E143: Līga Šmite | F143: 1991 | G143: Valmiera-Ripo autocentrs | H143: 0.12061342592592593 | I143: =H143-$H$138 -> 2.0023148148148151E-2 | J143: 19.6
C144: 7 | D144: 143 | E144: Anita Bērsone | F144: 1977 | G144: Eko Osta | H144: 0.12144675925925925 | I144: =H144-$H$138 -> 2.0856481481481476E-2 | J144: 19.5
C145: 8 | D145: 149 | E145: Līga Bitmane | F145: 1990 | G145: Tandēms/Drinkme Team | H145: 0.14488425925925927 | I145: =H145-$H$138 -> 4.429398148148149E-2 | J145: 16.3