A2: Vecuma grupa (līdz 2006.dz.g.)
A3: Vieta | B3: Dalībnieks | C3: Pārstāv | D3: Dz.g. | E3: 1.p. | F3: 2.p. | G3: 3.p. | H3: 4.p. | I3: 5.p. | J3: 6.p. | K3: Kopv.
A4: 1 | B4: Krāmēns Ralfs | D4: 2006 | E4: 8 | F4: 10 | G4: 5 | H4: 10 | I4: 8 | J4: 10 | K4: =SUM(E4:J4) -> 51
A5: 2 | B5: Esītis Markuss | D5: 2006 | E5: 10 | F5: 8 | G5: 10 | H5: 8 | I5: 6 | J5: 6 | K5: =SUM(E5:J5) -> 48
A6: 3 | B6: Radziņš Rihards | D6: 2006 | E6: 5 | F6: 4 | G6: 6 | H6: 6 | I6: 10 | J6: 8 | K6: =SUM(E6:J6) -> 39
A7: 4 | B7: Selga Elēna | D7: 2006 | E7: 3 | F7: 6 | G7: 1 | H7: 4 | I7: 5 | J7: 3 | K7: =SUM(E7:J7) -> 22
A8: 5 | B8: Krampe Emīls | C8: LAK 4 | D8: 2007 | E8: 4 | F8: 3 | G8: 3 | I8: 2 | J8: 4 | K8: =SUM(E8:J8) -> 16
A9: 6 | B9: Timermanis Edgars | C9: 4 sekundes | D9: 2006 | E9: 6 | G9: 8 | K9: =SUM(E9:J9) -> 14
A10: 7 | B10: Zeltiņa Beātrise | D10: 2007 | H10: 5 | I10: 4 | J10: 5 | K10: =SUM(E10:J10) -> 14
A11: 8 | B11: Sakalausks Rauls Kristers | D11: 2006 | F11: 2 | H11: 2 | I11: 1 | K11: =SUM(E11:J11) -> 5
A12: 9 | B12: Bēcis Artūrs | D12: 2008 | F12: 5 | K12: =SUM(E12:J12) -> 5
A13: 10 | B13: Markss Kristians | C13: Smiltene | D13: 2006 | F13: 1 | G13: 4 | K13: =SUM(E13:J13) -> 5
A14: 11 | B14: Lukstiņš Pēteris | D14: 2006 | H14: 1 | I14: 3 | K14: =SUM(E14:J14) -> 4
A15: 12 | B15: Viļkins Gusts | D15: 2006 | E15: 2 | J15: 2 | K15: =SUM(E15:J15) -> 4
A16: 13 | B16: Ivanovskis Kārlis | D16: 2006 | H16: 3 | K16: =SUM(E16:J16) -> 3
A17: 14 | B17: Brēde Bruno | D17: 2007 | E17: 1 | K17: =SUM(E17:J17) -> 1
A18: 15 | B18: Krasts Gustavs | D18: 2006 | G18: 1 | K18: =SUM(E18:J18) -> 1
A19: 16 | B19: Kalniņa Ieva | D19: 2006 | J19: 1 | K19: =SUM(E19:J19) -> 1
A21: Vecuma grupa (2005.dz.g.)
A22: Vieta | B22: Dalībnieks | C22: Pārstāv | D22: Dz.g. | E22: 1.p. | F22: 2.p. | G22: 3.p. | H22: 4.p. | I22: 5.p. | J22: 6.p. | K22: Kopv.
A23: 1 | B23: Ratnieks Krišjānis | C23: Riteņu vasara | D23: 2005 | E23: 10 | F23: 6 | G23: 10 | I23: 10 | J23: 10 | K23: =SUM(E23:J23) -> 46
A24: 2 | B24: Špērs Pēteris | C24: Rīga | D24: 2005 | E24: 6 | F24: 8 | G24: 6 | H24: 8 | I24: 5 | J24: 8 | K24: =SUM(E24:J24) -> 41
A25: 3 | B25: Vanags Ralfs Eduards | C25: Valmiera | D25: 2005 | E25: 8 | F25: 10 | G25: 8 | H25: 1 | K25: =SUM(E25:J25) -> 27
A26: 4 | B26: Broks Markuss | C26: Noķer ja vari | D26: 2005 | H26: 6 | I26: 8 | J26: 6 | K26: =SUM(E26:J26) -> 20
A27: 5 | B27: Stepāns Emīls | D27: 2005 | G27: 5 | H27: 4 | I27: 6 | K27: =SUM(E27:J27) -> 15
A28: 6 | B28: Zeidaks Kārlis | C28: Riteņu vasara | D28: 2005 | H28: 10 | K28: =SUM(E28:J28) -> 10
A29: 7 | B29: Stepāns Klāvs | D29: 2005 | G29: 4 | H29: 2 | I29: 4 | K29: =SUM(E29:J29) -> 10
A30: 8 | B30: Mušperts Tomass Arnolds | D30: 2005 | E30: 5 | F30: 4 | K30: =SUM(E30:J30) -> 9
A31: 9 | B31: Pasters Kārlis | D31: 2005 | E31: 4 | F31: 3 | K31: =SUM(E31:J31) -> 7
A32: 10 | B32: Kolovza Noa | D32: 2005 | I32: 3 | J32: 4 | K32: =SUM(E32:J32) -> 7
A33: 11 | B33: Vitkovska Vendija | D33: 2005 | I33: 2 | J33: 5 | K33: =SUM(E33:J33) -> 7
A34: 12 | B34: Binovskis Krišjānis | D34: 2005 | G34: 3 | H34: 3 | K34: =SUM(E34:J34) -> 6
A35: 13 | B35: Brūveris Alekss | D35: 2005 | F35: 5 | K35: =SUM(E35:J35) -> 5
A36: 14 | B36: Ivanovskis Emīls | D36: 2005 | H36: 5 | K36: =SUM(E36:J36) -> 5
A37: 15 | B37: Zuza Daniels | D37: 2005 | E37: 3 | F37: 1 | K37: =SUM(E37:J37) -> 4
A38: 16 | B38: Lošins Ričards | D38: 2005 | G38: 2 | J38: 2 | K38: =SUM(E38:J38) -> 4
A39: 17 | B39: Tērauds Dāgs Leonards | D39: 2005 | J39: 3 | K39: =SUM(E39:J39) -> 3
A40: 18 | B40: Rupeks Rupeiks Kristaps | D40: 2005 | F40: 2 | K40: =SUM(E40:J40) -> 2
A41: 19 | B41: Kursīte Madara | D41: 2005 | E41: 2 | K41: =SUM(E41:J41) -> 2
A42: 20 | B42: Upenieks Ralfs | D42: 2005 | I42: 1 | J42: 1 | K42: =SUM(E42:J42) -> 2
A43: 21 | B43: Rusmanis Martins Eduards | D43: 2005 | E43: 1 | K43: =SUM(E43:J43) -> 1
A44: 22 | B44: Roma Anna | D44: 2005 | G44: 1 | K44: =SUM(E44:J44) -> 1
A46: Vecuma grupa (2004.-2003.dz.g.)
A47: Vieta | B47: Dalībnieks | C47: Pārstāv | D47: Dz.g. | E47: 1.p. | F47: 2.p. | G47: 3.p. | H47: 4.p. | I47: 5.p. | J47: 6.p. | K47: Kopv.
A48: 1 | B48: Krampe Bruno | C48: LAK 4 | D48: 2003 | F48: 10 | G48: 10 | H48: 10 | I48: 10 | J48: 10 | K48: =SUM(E48:J48) -> 50
A49: 2 | B49: Jonass Marsels Mārcis | D49: 2003 | E49: 10 | F49: 8 | G49: 6 | H49: 8 | I49: 6 | J49: 6 | K49: =SUM(E49:J49) -> 44
A50: 3 | B50: Krampe Samanta | C50: LAK 4 | D50: 2003 | F50: 5 | G50: 8 | H50: 6 | I50: 8 | J50: 8 | K50: =SUM(E50:J50) -> 35
A51: 4 | B51: Avotiņš Artūrs Krišs | C51: Veloserviss | D51: 2003 | E51: 8 | F51: 6 | G51: 3 | I51: 5 | K51: =SUM(E51:J51) -> 22
A52: 5 | B52: Staņko Mārtiņš | C52: Vellapēda/AM furn. | D52: 2004 | E52: 3 | F52: 4 | K52: =SUM(E52:J52) -> 7
A53: 6 | B53: Bowen Saša | C53: Rietumu-Delfin | D53: 2003 | I53: 2 | J53: 5 | K53: =SUM(E53:J53) -> 7
A54: 7 | B54: Ustups Toms | E54: 6 | K54: =SUM(E54:J54) -> 6
A55: 8 | B55: Beķeris Bruno | E55: 5 | K55: =SUM(E55:J55) -> 5
A56: 9 | B56: Zīmelis Renārs | D56: 2004 | G56: 5 | K56: =SUM(E56:J56) -> 5
A57: 10 | B57: Kalniņš Ričards | D57: 2004 | F57: 2 | H57: 3 | K57: =SUM(E57:J57) -> 5
A58: 11 | B58: šits Dario | C58: Klondaika | D58: 2004 | H58: 5 | K58: =SUM(E58:J58) -> 5
A59: 12 | B59: Bleikš Roberts | C59: Smiltene 4 sek. | D59: 2004 | G59: 4 | I59: 1 | K59: =SUM(E59:J59) -> 5
A60: 13 | B60: Zvingule Agnija Paula | C60: Kuldīga | D60: 2004 | H60: 2 | J60: 3 | K60: =SUM(E60:J60) -> 5
A61: 14 | B61: Kiršteins Ralfs | E61: 4 | K61: =SUM(E61:J61) -> 4
A62: 15 | B62: Beļajevs Rodrigo | C62: AGL-AUTO | D62: 2004 | H62: 4 | K62: =SUM(E62:J62) -> 4
A63: 16 | B63: Miķelsons Kristaps | C63: Valmiera | D63: 2004 | I63: 4 | K63: =SUM(E63:J63) -> 4
A64: 17 | B64: Mīļais Daniels | D64: 2003 | J64: 4 | K64: =SUM(E64:J64) -> 4
A65: 18 | B65: Pirktiņš Kārlis | D65: 2004 | F65: 3 | K65: =SUM(E65:J65) -> 3
A66: 19 | B66: Lukstiņš Gustavs | C66: Gustava superklubs | D66: 2003 | I66: 3 | K66: =SUM(E66:J66) -> 3
A67: 20 | B67: Spicins Ivan | E67: 2 | K67: =SUM(E67:J67) -> 2
A68: 21 | B68: Loginovs Matīss | D68: 2003 | G68: 2 | K68: =SUM(E68:J68) -> 2
A69: 22 | B69: Bērziņa Katrīna | D69: 2003 | J69: 2 | K69: =SUM(E69:J69) -> 2
A70: 23 | B70: Brūveris Ralfs | E70: 1 | K70: =SUM(E70:J70) -> 1
A71: 24 | B71: Džarcāns Emīls | D71: 2004 | F71: 1 | K71: =SUM(E71:J71) -> 1
A72: 25 | B72: Ziedkalns Renārs | D72: 2004 | G72: 1 | K72: =SUM(E72:J72) -> 1
A73: 26 | B73: Neļķe Ernests | C73: MTB Garkalne | D73: 2003 | H73: 1 | K73: =SUM(E73:J73) -> 1
A74: 27 | B74: Sokolovs Tomass | D74: 2004 | J74: 1 | K74: =SUM(E74:J74) -> 1
A76: Vecuma grupa (2002.-2001.dz.g.)
A77: Vieta | B77: Dalībnieks | C77: Pārstāv | D77: Dz.g. | E77: 1.p. | F77: 2.p. | G77: 3.p. | H77: 4.p. | I77: 5.p. | J77: 6.p. | K77: Kopv.
A78: 1 | B78: Krasts Alekss | C78: Valmieras Piens | D78: 2001 | E78: 10 | F78: 10 | G78: 10 | H78: 10 | I78: 10 | J78: 10 | K78: =SUM(E78:J78) -> 60
A79: 2 | B79: Tomsons Artūrs | C79: ZZK Cēsis SEB | D79: 2001 | E79: 8 | F79: 8 | G79: 8 | H79: 6 | I79: 8 | J79: 8 | K79: =SUM(E79:J79) -> 46
A80: 3 | B80: Rubenis Pauls | C80: starpsienu centrs | D80: 2001 | E80: 6 | F80: 3 | H80: 5 | I80: 6 | J80: 6 | K80: =SUM(E80:J80) -> 26
A81: 4 | B81: Markitāne Elizabete Līna | D81: 2001 | E81: 4 | F81: 4 | G81: 5 | H81: 8 | K81: =SUM(E81:J81) -> 21
A82: 5 | B82: Ūdris Artūrs | C82: Valmiera | D82: 2002 | E82: 5 | F82: 6 | G82: 6 | K82: =SUM(E82:J82) -> 17
A83: 6 | B83: Godiņš Arvo | D83: 2002 | E83: 3 | I83: 4 | J83: 5 | K83: =SUM(E83:J83) -> 12
A84: 7 | B84: Gaiķe Alise | C84: Lielvārde | D84: 2001 | E84: 1 | F84: 2 | G84: 1 | H84: 4 | J84: 3 | K84: =SUM(E84:J84) -> 11
A85: 8 | B85: Birkentāls Renārs | D85: 2001 | F85: 5 | G85: 4 | K85: =SUM(E85:J85) -> 9
A86: 9 | B86: Zenģis Rūdolfs | D86: 2002 | G86: 2 | I86: 5 | K86: =SUM(E86:J86) -> 7
A87: 10 | B87: Bēmers Markuss | C87: Novatour | D87: 2002 | J87: 4 | K87: =SUM(E87:J87) -> 4
A88: 11 | B88: Simsons Gusts | C88: MTB Priekuļi | D88: 2002 | G88: 3 | K88: =SUM(E88:J88) -> 3
A89: 12 | B89: Čukurs Ingars | D89: 2001 | H89: 3 | K89: =SUM(E89:J89) -> 3
A90: 13 | B90: Kaņepēja Enia | C90: PSK Skanste | D90: 2001 | I90: 3 | K90: =SUM(E90:J90) -> 3
A91: 14 | B91: Šteinbergs Jānis | C91: Salaspils zīriņi | D91: 2002 | E91: 2 | J91: 1 | K91: =SUM(E91:J91) -> 3
A92: 15 | B92: Balodis Mareks | C92: Virsotne Marmot | D92: 2001 | F92: 1 | H92: 1 | K92: =SUM(E92:J92) -> 2
A93: 16 | B93: Rudzītis Jēkabs | D93: 2002 | H93: 2 | K93: =SUM(E93:J93) -> 2
A94: 17 | B94: Zvirbulis Rūdolfs Jānis | D94: 2002 | I94: 2 | K94: =SUM(E94:J94) -> 2
A95: 18 | B95: Riekstiņa Anna | D95: 2002 | J95: 2 | K95: =SUM(E95:J95) -> 2
A96: 19 | B96: Zeltiņš Toms Henrijs | D96: 2001 | I96: 1 | K96: =SUM(E96:J96) -> 1
A98: Vecuma grupa (2000.-1999.dz.g.)
A99: Vieta | B99: Dalībnieks | C99: Pārstāv | D99: Dz.g. | E99: 1.p. | F99: 2.p. | G99: 3.p. | H99: 4.p. | I99: 5.p. | J99: 6.p. | K99: Kopv.
A100: 1 | B100: Rozenfelds Adams Veins | C100: Tandēms | D100: 2000 | E100: 8 | F100: 8 | G100: 4 | H100: 8 | I100: 10 | J100: 8 | K100: =SUM(E100:J100) -> 46
A101: 2 | B101: Kazaine Alise | D101: 1999 | G101: 8 | H101: 10 | I101: 8 | J101: 10 | K101: =SUM(E101:J101) -> 36
A102: 3 | B102: Pētersone Vineta | D102: 1999 | E102: 10 | G102: 10 | K102: =SUM(E102:J102) -> 20
A103: 4 | B103: Vimba Rūdolfs Matīss | C103: Valmiera | D103: 2000 | E103: 6 | G103: 6 | J103: 6 | K103: =SUM(E103:J103) -> 18
A104: 5 | B104: Krasts Artūrs | C104: Smiltene | D104: 2000 | F104: 6 | G104: 5 | I104: 5 | K104: =SUM(E104:J104) -> 16
A105: 6 | B105: Āre Atis | D105: 2000 | G105: 2 | I105: 6 | J105: 5 | K105: =SUM(E105:J105) -> 13
A106: 7 | B106: Ratniece Marta | C106: Riteņu vasara | D106: 2000 | E106: 5 | F106: 1 | H106: 5 | K106: =SUM(E106:J106) -> 11
A107: 8 | B107: Velps Matīss | C107: 4 sekundes | D107: 1999 | F107: 10 | K107: =SUM(E107:J107) -> 10
A108: 9 | B108: Eliass Martins | C108: Dod ručkā | D108: 2000 | E108: 4 | F108: 3 | G108: 3 | K108: =SUM(E108:J108) -> 10
A109: 10 | B109: Rūsiņš Kristiāns | C109: Toyota team | D109: 2000 | E109: 2 | H109: 6 | I109: 1 | K109: =SUM(E109:J109) -> 9
A110: 11 | B110: Katena Dagnija | D110: 2000 | E110: 1 | H110: 3 | I110: 3 | J110: 2 | K110: =SUM(E110:J110) -> 9
A111: 12 | B111: Šnē Ivo | C111: 4 sekundes | D111: 1999 | F111: 5 | K111: =SUM(E111:J111) -> 5
A112: 13 | B112: Bļizņuks Aleksandrs | C112: RRS Baloži | D112: 1999 | F112: 4 | K112: =SUM(E112:J112) -> 4
A113: 14 | B113: Belevičs Jēkabs | D113: 2000 | H113: 4 | K113: =SUM(E113:J113) -> 4
A114: 15 | B114: Vērdiņš Gints | D114: 1999 | I114: 4 | K114: =SUM(E114:J114) -> 4
A115: 16 | B115: Fūrmanis Āris | D115: 2000 | J115: 4 | K115: =SUM(E115:J115) -> 4
A116: 17 | B116: Parijuks Kristiāns | E116: 3 | K116: =SUM(E116:J116) -> 3
A117: 18 | B117: Prokofjeva Linda | D117: 2000 | G117: 1 | H117: 2 | K117: =SUM(E117:J117) -> 3
A118: 19 | B118: Tipāns Ēriks Gustavs | D118: 1999 | J118: 3 | K118: =SUM(E118:J118) -> 3
A119: 20 | B119: Iļjenko Mārtiņš Andrejs | C119: Rīgas Teikas vsk. | D119: 2000 | F119: 2 | K119: =SUM(E119:J119) -> 2
A120: 21 | B120: Piļicka Ingija Laine | D120: 1999 | I120: 2 | K120: =SUM(E120:J120) -> 2
A121: 22 | B121: Gajevskis Artjoms | D121: 2000 | J121: 1 | K121: =SUM(E121:J121) -> 1