A1: "Lāsēns" Bērnu brauciens - kopvērtējums pēc 2 posmiem
A3: Vecuma grupa (līdz 2006.dz.g.)
A4: Vieta | B4: Dalībnieks | C4: Pārstāv | D4: Dz.g. | E4: Punkti 1.p. | F4: Punkti 2.p. | G4: Kopv.
A5: 1 | B5: Krāmēns Ralfs | D5: 2006 | E5: 8 | F5: 10 | G5: =SUM(E5:F5) -> 18
A6: 2 | B6: Esītis Markuss | D6: 2006 | E6: 10 | F6: 8 | G6: =SUM(E6:F6) -> 18
A7: 3 | B7: Selga Elēna | D7: 2006 | E7: 3 | F7: 6 | G7: =SUM(E7:F7) -> 9
A8: 4 | B8: Radziņš Rihards | D8: 2006 | E8: 5 | F8: 4 | G8: =SUM(E8:F8) -> 9
A9: 5 | B9: Krampe Emīls | C9: LAK 4 | D9: 2007 | E9: 4 | F9: 3 | G9: =SUM(E9:F9) -> 7
A10: 6 | B10: Timermanis Edgars | C10: 4 sekundes | D10: 2006 | E10: 6 | G10: =SUM(E10:F10) -> 6
A11: 7 | B11: Bēcis Artūrs | D11: 2008 | F11: 5 | G11: =SUM(E11:F11) -> 5
A12: 8 | B12: Sakalausks Rauls Kristers | D12: 2006 | F12: 2 | G12: =SUM(E12:F12) -> 2
A13: 9 | B13: Viļkins Gusts | D13: 2006 | E13: 2 | G13: =SUM(E13:F13) -> 2
A14: 10 | B14: Markss Kristians | C14: Smiltene | D14: 2006 | F14: 1 | G14: =SUM(E14:F14) -> 1
A15: 11 | B15: Brēde Bruno | D15: 2007 | E15: 1 | G15: =SUM(E15:F15) -> 1
A18: Vecuma grupa (2005.dz.g.)
A19: Vieta | B19: Dalībnieks | C19: Pārstāv | D19: Dz.g. | E19: Punkti 1.p. | F19: Punkti 2.p. | G19: Kopv.
A20: 1 | B20: Vanags Ralfs Eduards | C20: Valmiera | D20: 2005 | E20: 8 | F20: 10 | G20: =SUM(E20:F20) -> 18
A21: 2 | B21: Ratnieks Krišjānis | C21: Riteņu vasara | D21: 2005 | E21: 10 | F21: 6 | G21: =SUM(E21:F21) -> 16
A22: 3 | B22: Špērs Pēteris | C22: Rīga | D22: 2005 | E22: 6 | F22: 8 | G22: =SUM(E22:F22) -> 14
A23: 4 | B23: Mušperts Tomass Arnolds | D23: 2005 | E23: 5 | F23: 4 | G23: =SUM(E23:F23) -> 9
A24: 5 | B24: Pasters Kārlis | D24: 2005 | E24: 4 | F24: 3 | G24: =SUM(E24:F24) -> 7
A25: 6 | B25: Brūveris Alekss | D25: 2005 | F25: 5 | G25: =SUM(E25:F25) -> 5
A26: 7 | B26: Zuza Daniels | D26: 2005 | E26: 3 | F26: 1 | G26: =SUM(E26:F26) -> 4
A27: 8 | B27: Rupeks Rupeiks Kristaps | D27: 2005 | F27: 2 | G27: =SUM(E27:F27) -> 2
A28: 9 | B28: Kursīte Madara | D28: 2005 | E28: 2 | G28: =SUM(E28:F28) -> 2
A29: 10 | B29: Rusmanis Martins Eduards | D29: 2005 | E29: 1 | G29: =SUM(E29:F29) -> 1
A31: Vecuma grupa (2004.-2003.dz.g.)
A32: Vieta | B32: Dalībnieks | C32: Pārstāv | D32: Dz.g. | E32: Punkti 1.p. | F32: Punkti 2.p. | G32: Kopv.
A33: 1 | B33: Jonass Marsels Mārcis | D33: 2003 | E33: 10 | F33: 8 | G33: =SUM(E33:F33) -> 18
A34: 2 | B34: Avotiņš Artūrs Krišs | C34: Veloserviss | D34: 2003 | E34: 8 | F34: 6 | G34: =SUM(E34:F34) -> 14
A35: 3 | B35: Krampe Bruno | C35: LAK 4 | D35: 2003 | F35: 10 | G35: =SUM(E35:F35) -> 10
A36: 4 | B36: Staņko Mārtiņš | C36: Vellapēda/AM furn. | D36: 2004 | E36: 3 | F36: 4 | G36: =SUM(E36:F36) -> 7
A37: 5 | B37: Ustups Toms | E37: 6 | G37: =SUM(E37:F37) -> 6
A38: 6 | B38: Beķeris Bruno | E38: 5 | G38: =SUM(E38:F38) -> 5
A39: 7 | B39: Krampe Samanta | C39: LAK 4 | D39: 2003 | F39: 5 | G39: =SUM(E39:F39) -> 5
A40: 8 | B40: Kiršteins Ralfs | E40: 4 | G40: =SUM(E40:F40) -> 4
A41: 9 | B41: Pirktiņš Kārlis | D41: 2004 | F41: 3 | G41: =SUM(E41:F41) -> 3
A42: 10 | B42: Spicins Ivan | E42: 2 | G42: =SUM(E42:F42) -> 2
A43: 11 | B43: Kalniņš Ričards | D43: 2004 | F43: 2 | G43: =SUM(E43:F43) -> 2
A44: 12 | B44: Brūveris Ralfs | E44: 1 | G44: =SUM(E44:F44) -> 1
A45: 13 | B45: Džarcāns Emīls | D45: 2004 | F45: 1 | G45: =SUM(E45:F45) -> 1
A48: Vecuma grupa (2002.-2001.dz.g.)
A49: Vieta | B49: Dalībnieks | C49: Pārstāv | D49: Dz.g. | E49: Punkti 1.p. | F49: Punkti 2.p. | G49: Kopv.
A50: 1 | B50: Krasts Alekss | C50: Valmieras Piens | D50: 2001 | E50: 10 | F50: 10 | G50: =SUM(E50:F50) -> 20
A51: 2 | B51: Tomsons Artūrs | C51: ZZK Cēsis SEB | D51: 2001 | E51: 8 | F51: 8 | G51: =SUM(E51:F51) -> 16
A52: 3 | B52: Ūdris Artūrs | C52: Valmiera | D52: 2002 | E52: 5 | F52: 6 | G52: =SUM(E52:F52) -> 11
A53: 4 | B53: Rubenis Pauls | C53: starpsienu centrs | D53: 2001 | E53: 6 | F53: 3 | G53: =SUM(E53:F53) -> 9
A54: 5 | B54: Markitāne Elizabete Līna | D54: 2001 | E54: 4 | F54: 4 | G54: =SUM(E54:F54) -> 8
A55: 6 | B55: Birkentāls Renārs | D55: 2001 | F55: 5 | G55: =SUM(E55:F55) -> 5
A56: 7 | B56: Gaiķe Alise | C56: Lielvārde | D56: 2001 | E56: 1 | F56: 2 | G56: =SUM(E56:F56) -> 3
A57: 8 | B57: Godiņš Arvo | D57: 2002 | E57: 3 | G57: =SUM(E57:F57) -> 3
A58: 9 | B58: Šteinbergs Jānis | C58: Salaspils zīriņi | E58: 2 | G58: =SUM(E58:F58) -> 2
A59: 10 | B59: Balodis Mareks | C59: Virsotne Marmot | D59: 2001 | F59: 1 | G59: =SUM(E59:F59) -> 1
A62: Vecuma grupa (2000.-1999.dz.g.)
A63: Vieta | B63: Dalībnieks | C63: Pārstāv | D63: Dz.g. | E63: Punkti 1.p. | F63: Punkti 2.p. | G63: Kopv.
A64: 1 | B64: Rozenfelds Adams Veins | C64: Tandēms | D64: 2000 | E64: 8 | F64: 8 | G64: =SUM(E64:F64) -> 16
A65: 2 | B65: Pētersone Vineta | E65: 10 | G65: =SUM(E65:F65) -> 10
A66: 3 | B66: Velps Matīss | C66: 4 sekundes | D66: 1999 | F66: 10 | G66: =SUM(E66:F66) -> 10
A67: 4 | B67: Eliass Martins | C67: Dod ručkā | D67: 2000 | E67: 4 | F67: 3 | G67: =SUM(E67:F67) -> 7
A68: 5 | B68: Ratniece Marta | C68: Riteņu vasara | D68: 2000 | E68: 5 | F68: 1 | G68: =SUM(E68:F68) -> 6
A69: 6 | B69: Vimba Rūdolfs | C69: Valmiera | E69: 6 | G69: =SUM(E69:F69) -> 6
A70: 7 | B70: Krasts Artūrs | C70: Smiltene | D70: 2000 | F70: 6 | G70: =SUM(E70:F70) -> 6
A71: 8 | B71: Šnē Ivo | C71: 4 sekundes | D71: 1999 | F71: 5 | G71: =SUM(E71:F71) -> 5
A72: 9 | B72: Bļizņuks Aleksandrs | C72: RRS Baloži | D72: 1999 | F72: 4 | G72: =SUM(E72:F72) -> 4
A73: 10 | B73: Parijuks Kristiāns | E73: 3 | G73: =SUM(E73:F73) -> 3
A74: 11 | B74: Rūsiņš Kristiāns | C74: Toyota team | D74: 2000 | E74: 2 | G74: =SUM(E74:F74) -> 2
A75: 12 | B75: Iļjenko Mārtiņš Andrejs | C75: Rīgas Teikas vsk. | D75: 2000 | F75: 2 | G75: =SUM(E75:F75) -> 2
A76: 13 | B76: Katena Dagnija | D76: 2000 | E76: 1 | G76: =SUM(E76:F76) -> 1