A2: Vecuma grupa (līdz 2006.dz.g.)
A3: Vieta | B3: Dalībnieks | C3: Pārstāv | D3: Dz.g. | E3: 1.p. | F3: 2.p. | G3: 3.p. | H3: 4.p. | I3: 5.p. | J3: 6.p. | K3: 7.p. | L3: Kopv.
A4: 1 | B4: Krāmēns Ralfs | D4: 2006 | E4: 8 | F4: 10 | G4: 5 | H4: 10 | I4: 8 | J4: 10 | K4: 10 | L4: =SUM(E4:K4) -> 61
A5: 2 | B5: Esītis Markuss | D5: 2006 | E5: 10 | F5: 8 | G5: 10 | H5: 8 | I5: 6 | J5: 6 | K5: 8 | L5: =SUM(E5:K5) -> 56
A6: 3 | B6: Radziņš Rihards | D6: 2006 | E6: 5 | F6: 4 | G6: 6 | H6: 6 | I6: 10 | J6: 8 | K6: 6 | L6: =SUM(E6:K6) -> 45
A7: 4 | B7: Selga Elēna | D7: 2006 | E7: 3 | F7: 6 | G7: 1 | H7: 4 | I7: 5 | J7: 3 | K7: 2 | L7: =SUM(E7:K7) -> 24
A8: 5 | B8: Zeltiņa Beātrise | D8: 2007 | H8: 5 | I8: 4 | J8: 5 | K8: 3 | L8: =SUM(E8:K8) -> 17
A9: 6 | B9: Krampe Emīls | C9: LAK 4 | D9: 2007 | E9: 4 | F9: 3 | G9: 3 | I9: 2 | J9: 4 | L9: =SUM(E9:K9) -> 16
A10: 7 | B10: Timermanis Edgars | C10: 4 sekundes | D10: 2006 | E10: 6 | G10: 8 | L10: =SUM(E10:K10) -> 14
A11: 8 | B11: Sakalausks Rauls Kristers | D11: 2006 | F11: 2 | H11: 2 | I11: 1 | K11: 5 | L11: =SUM(E11:K11) -> 10
A12: 9 | B12: Bēcis Artūrs | D12: 2008 | F12: 5 | L12: =SUM(E12:K12) -> 5
A13: 10 | B13: Markss Kristians | C13: Smiltene | D13: 2006 | F13: 1 | G13: 4 | L13: =SUM(E13:K13) -> 5
A14: 11 | B14: Beķeris Rūdolfs | D14: 2006 | K14: 4 | L14: =SUM(E14:K14) -> 4
A15: 12 | B15: Lukstiņš Pēteris | D15: 2006 | H15: 1 | I15: 3 | L15: =SUM(E15:K15) -> 4
A16: 13 | B16: Viļkins Gusts | D16: 2006 | E16: 2 | J16: 2 | L16: =SUM(E16:K16) -> 4
A17: 14 | B17: Ivanovskis Kārlis | D17: 2006 | H17: 3 | L17: =SUM(E17:K17) -> 3
A18: 15 | B18: Krasts Gustavs | D18: 2006 | G18: 1 | K18: 1 | L18: =SUM(E18:K18) -> 2
A19: 16 | B19: Brēde Bruno | D19: 2007 | E19: 1 | L19: =SUM(E19:K19) -> 1
A20: 17 | B20: Kalniņa Ieva | D20: 2006 | J20: 1 | L20: =SUM(E20:K20) -> 1
A23: Vecuma grupa (2005.dz.g.)
A24: Vieta | B24: Dalībnieks | C24: Pārstāv | D24: Dz.g. | E24: 1.p. | F24: 2.p. | G24: 3.p. | H24: 4.p. | I24: 5.p. | J24: 6.p. | K24: 7.p. | L24: Kopv.
A25: 1 | B25: Ratnieks Krišjānis | C25: Riteņu vasara | D25: 2005 | E25: 10 | F25: 6 | G25: 10 | I25: 10 | J25: 10 | K25: 10 | L25: =SUM(E25:K25) -> 56
A26: 2 | B26: Špērs Pēteris | C26: Rīga | D26: 2005 | E26: 6 | F26: 8 | G26: 6 | H26: 8 | I26: 5 | J26: 8 | K26: 5 | L26: =SUM(E26:K26) -> 46
A27: 3 | B27: Vanags Ralfs Eduards | C27: Valmiera | D27: 2005 | E27: 8 | F27: 10 | G27: 8 | H27: 1 | L27: =SUM(E27:K27) -> 27
A28: 4 | B28: Broks Markuss | C28: Noķer ja vari | D28: 2005 | H28: 6 | I28: 8 | J28: 6 | K28: 6 | L28: =SUM(E28:K28) -> 26
A29: 5 | B29: Zeidaks Kārlis | C29: Riteņu vasara | D29: 2005 | H29: 10 | K29: 8 | L29: =SUM(E29:K29) -> 18
A30: 6 | B30: Stepāns Emīls | D30: 2005 | G30: 5 | H30: 4 | I30: 6 | L30: =SUM(E30:K30) -> 15
A31: 7 | B31: Stepāns Klāvs | D31: 2005 | G31: 4 | H31: 2 | I31: 4 | L31: =SUM(E31:K31) -> 10
A32: 8 | B32: Mušperts Tomass Arnolds | D32: 2005 | E32: 5 | F32: 4 | L32: =SUM(E32:K32) -> 9
A33: 9 | B33: Pasters Kārlis | D33: 2005 | E33: 4 | F33: 3 | L33: =SUM(E33:K33) -> 7
A34: 10 | B34: Kolovza Noa | D34: 2005 | I34: 3 | J34: 4 | L34: =SUM(E34:K34) -> 7
A35: 11 | B35: Vitkovska Vendija | D35: 2005 | I35: 2 | J35: 5 | L35: =SUM(E35:K35) -> 7
A36: 12 | B36: Binovskis Krišjānis | D36: 2005 | G36: 3 | H36: 3 | L36: =SUM(E36:K36) -> 6
A37: 13 | B37: Brūveris Alekss | D37: 2005 | F37: 5 | L37: =SUM(E37:K37) -> 5
A38: 14 | B38: Ivanovskis Emīls | D38: 2005 | H38: 5 | L38: =SUM(E38:K38) -> 5
A39: 15 | B39: Zuza Daniels | D39: 2005 | E39: 3 | F39: 1 | L39: =SUM(E39:K39) -> 4
A40: 16 | B40: Lošins Ričards | D40: 2005 | G40: 2 | J40: 2 | L40: =SUM(E40:K40) -> 4
A41: 17 | B41: Zaļupe Kristofs | D41: 2005 | K41: 4 | L41: =SUM(E41:K41) -> 4
A42: 18 | B42: Tērauds Dāgs Leonards | D42: 2005 | J42: 3 | L42: =SUM(E42:K42) -> 3
A43: 19 | B43: Blasāns Emīls | D43: 2005 | K43: 3 | L43: =SUM(E43:K43) -> 3
A44: 20 | B44: Rupeks Rupeiks Kristaps | D44: 2005 | F44: 2 | L44: =SUM(E44:K44) -> 2
A45: 21 | B45: Kursīte Madara | D45: 2005 | E45: 2 | L45: =SUM(E45:K45) -> 2
A46: 22 | B46: Upenieks Ralfs | D46: 2005 | I46: 1 | J46: 1 | L46: =SUM(E46:K46) -> 2
A47: 23 | B47: Milča Alise | D47: 2005 | K47: 2 | L47: =SUM(E47:K47) -> 2
A48: 24 | B48: Rusmanis Martins Eduards | D48: 2005 | E48: 1 | L48: =SUM(E48:K48) -> 1
A49: 25 | B49: Roma Anna | D49: 2005 | G49: 1 | L49: =SUM(E49:K49) -> 1
A50: 26 | B50: Paltiņš Dominiks | D50: 2005 | K50: 1 | L50: =SUM(E50:K50) -> 1
A52: Vecuma grupa (2004.-2003.dz.g.)
A53: Vieta | B53: Dalībnieks | C53: Pārstāv | D53: Dz.g. | E53: 1.p. | F53: 2.p. | G53: 3.p. | H53: 4.p. | I53: 5.p. | J53: 6.p. | K53: 7.p. | L53: Kopv.
A54: 1 | B54: Krampe Bruno | C54: LAK 4 | D54: 2003 | F54: 10 | G54: 10 | H54: 10 | I54: 10 | J54: 10 | K54: 10 | L54: =SUM(E54:K54) -> 60
A55: 2 | B55: Jonass Marsels Mārcis | D55: 2003 | E55: 10 | F55: 8 | G55: 6 | H55: 8 | I55: 6 | J55: 6 | K55: 6 | L55: =SUM(E55:K55) -> 50
A56: 3 | B56: Krampe Samanta | C56: LAK 4 | D56: 2003 | F56: 5 | G56: 8 | H56: 6 | I56: 8 | J56: 8 | K56: 8 | L56: =SUM(E56:K56) -> 43
A57: 4 | B57: Avotiņš Artūrs Krišs | C57: Veloserviss | D57: 2003 | E57: 8 | F57: 6 | G57: 3 | I57: 5 | L57: =SUM(E57:K57) -> 22
A58: 5 | B58: Staņko Mārtiņš | C58: Vellapēda/AM furn. | D58: 2004 | E58: 3 | F58: 4 | L58: =SUM(E58:K58) -> 7
A59: 6 | B59: Bowen Saša | C59: Rietumu-Delfin | D59: 2003 | I59: 2 | J59: 5 | L59: =SUM(E59:K59) -> 7
A60: 7 | B60: Bleikš Roberts | C60: Smiltene 4 sek. | D60: 2004 | G60: 4 | I60: 1 | K60: 2 | L60: =SUM(E60:K60) -> 7
A61: 8 | B61: Ustups Toms | E61: 6 | L61: =SUM(E61:K61) -> 6
A62: 9 | B62: Beķeris Bruno | E62: 5 | L62: =SUM(E62:K62) -> 5
A63: 10 | B63: Zīmelis Renārs | D63: 2004 | G63: 5 | L63: =SUM(E63:K63) -> 5
A64: 11 | B64: Kalniņš Ričards | D64: 2004 | F64: 2 | H64: 3 | L64: =SUM(E64:K64) -> 5
A65: 12 | B65: šits Dario | C65: Klondaika | D65: 2004 | H65: 5 | L65: =SUM(E65:K65) -> 5
A66: 13 | B66: Zvingule Agnija Paula | C66: Kuldīga | D66: 2004 | H66: 2 | J66: 3 | L66: =SUM(E66:K66) -> 5
A67: 14 | B67: Kalveršs Matīss | D67: 2003 | K67: 5 | L67: =SUM(E67:K67) -> 5
A68: 15 | B68: Kiršteins Ralfs | E68: 4 | L68: =SUM(E68:K68) -> 4
A69: 16 | B69: Beļajevs Rodrigo | C69: AGL-AUTO | D69: 2004 | H69: 4 | L69: =SUM(E69:K69) -> 4
A70: 17 | B70: Miķelsons Kristaps | C70: Valmiera | D70: 2004 | I70: 4 | L70: =SUM(E70:K70) -> 4
A71: 18 | B71: Mīļais Daniels | D71: 2003 | J71: 4 | L71: =SUM(E71:K71) -> 4
A72: 19 | B72: Sokolovs Tomass | D72: 2004 | J72: 1 | K72: 3 | L72: =SUM(E72:K72) -> 4
A73: 20 | B73: Krēsliņš Ernests | D73: 2003 | K73: 4 | L73: =SUM(E73:K73) -> 4
A74: 21 | B74: Pirktiņš Kārlis | D74: 2004 | F74: 3 | L74: =SUM(E74:K74) -> 3
A75: 22 | B75: Lukstiņš Gustavs | C75: Gustava superklubs | D75: 2003 | I75: 3 | L75: =SUM(E75:K75) -> 3
A76: 23 | B76: Spicins Ivan | E76: 2 | L76: =SUM(E76:K76) -> 2
A77: 24 | B77: Loginovs Matīss | D77: 2003 | G77: 2 | L77: =SUM(E77:K77) -> 2
A78: 25 | B78: Bērziņa Katrīna | D78: 2003 | J78: 2 | L78: =SUM(E78:K78) -> 2
A79: 26 | B79: Brūveris Ralfs | E79: 1 | L79: =SUM(E79:K79) -> 1
A80: 27 | B80: Džarcāns Emīls | D80: 2004 | F80: 1 | L80: =SUM(E80:K80) -> 1
A81: 28 | B81: Ziedkalns Renārs | D81: 2004 | G81: 1 | L81: =SUM(E81:K81) -> 1
A82: 29 | B82: Neļķe Ernests | C82: MTB Garkalne | D82: 2003 | H82: 1 | L82: =SUM(E82:K82) -> 1
A83: 30 | B83: Zīle Kristaps | D83: 2003 | K83: 1 | L83: =SUM(E83:K83) -> 1
A85: Vecuma grupa (2002.-2001.dz.g.)
A86: Vieta | B86: Dalībnieks | C86: Pārstāv | D86: Dz.g. | E86: 1.p. | F86: 2.p. | G86: 3.p. | H86: 4.p. | I86: 5.p. | J86: 6.p. | K86: 7.p. | L86: Kopv.
A87: 1 | B87: Krasts Alekss | C87: Valmieras Piens | D87: 2001 | E87: 10 | F87: 10 | G87: 10 | H87: 10 | I87: 10 | J87: 10 | K87: 8 | L87: =SUM(E87:K87) -> 68
A88: 2 | B88: Tomsons Artūrs | C88: ZZK Cēsis SEB | D88: 2001 | E88: 8 | F88: 8 | G88: 8 | H88: 6 | I88: 8 | J88: 8 | K88: 6 | L88: =SUM(E88:K88) -> 52
A89: 3 | B89: Rubenis Pauls | C89: starpsienu centrs | D89: 2001 | E89: 6 | F89: 3 | H89: 5 | I89: 6 | J89: 6 | K89: 10 | L89: =SUM(E89:K89) -> 36
A90: 4 | B90: Markitāne Elizabete Līna | D90: 2001 | E90: 4 | F90: 4 | G90: 5 | H90: 8 | K90: 3 | L90: =SUM(E90:K90) -> 24
A91: 5 | B91: Ūdris Artūrs | C91: Valmiera | D91: 2002 | E91: 5 | F91: 6 | G91: 6 | L91: =SUM(E91:K91) -> 17
A92: 6 | B92: Godiņš Arvo | D92: 2002 | E92: 3 | I92: 4 | J92: 5 | K92: 5 | L92: =SUM(E92:K92) -> 17
A93: 7 | B93: Gaiķe Alise | C93: Lielvārde | D93: 2001 | E93: 1 | F93: 2 | G93: 1 | H93: 4 | J93: 3 | L93: =SUM(E93:K93) -> 11
A94: 8 | B94: Birkentāls Renārs | D94: 2001 | F94: 5 | G94: 4 | L94: =SUM(E94:K94) -> 9
A95: 9 | B95: Zenģis Rūdolfs | D95: 2002 | G95: 2 | I95: 5 | L95: =SUM(E95:K95) -> 7
A96: 10 | B96: Bēmers Markuss | C96: Novatour | D96: 2002 | J96: 4 | L96: =SUM(E96:K96) -> 4
A97: 11 | B97: Krievs Kaspars | D97: 2001 | K97: 4 | L97: =SUM(E97:K97) -> 4
A98: 12 | B98: Simsons Gusts | C98: MTB Priekuļi | D98: 2002 | G98: 3 | L98: =SUM(E98:K98) -> 3
A99: 13 | B99: Čukurs Ingars | D99: 2001 | H99: 3 | L99: =SUM(E99:K99) -> 3
A100: 14 | B100: Kaņepēja Enia | C100: PSK Skanste | D100: 2001 | I100: 3 | L100: =SUM(E100:K100) -> 3
A101: 15 | B101: Šteinbergs Jānis | C101: Salaspils zīriņi | D101: 2002 | E101: 2 | J101: 1 | L101: =SUM(E101:K101) -> 3
A102: 16 | B102: Zvirbulis Rūdolfs Jānis | D102: 2002 | I102: 2 | K102: 1 | L102: =SUM(E102:K102) -> 3
A103: 17 | B103: Balodis Mareks | C103: Virsotne Marmot | D103: 2001 | F103: 1 | H103: 1 | L103: =SUM(E103:K103) -> 2
A104: 18 | B104: Rudzītis Jēkabs | D104: 2002 | H104: 2 | L104: =SUM(E104:K104) -> 2
A105: 19 | B105: Riekstiņa Anna | D105: 2002 | J105: 2 | L105: =SUM(E105:K105) -> 2
A106: 20 | B106: Apsītis Daniels | D106: 2002 | K106: 2 | L106: =SUM(E106:K106) -> 2
A107: 21 | B107: Zeltiņš Toms Henrijs | D107: 2001 | I107: 1 | L107: =SUM(E107:K107) -> 1
A111: Vecuma grupa (2000.-1999.dz.g.)
A112: Vieta | B112: Dalībnieks | C112: Pārstāv | D112: Dz.g. | E112: 1.p. | F112: 2.p. | G112: 3.p. | H112: 4.p. | I112: 5.p. | J112: 6.p. | K112: 7.p. | L112: Kopv.
A113: 1 | B113: Rozenfelds Adams Veins | C113: Tandēms | D113: 2000 | E113: 8 | F113: 8 | G113: 4 | H113: 8 | I113: 10 | J113: 8 | K113: 4 | L113: =SUM(E113:K113) -> 50
A114: 2 | B114: Kazaine Alise | D114: 1999 | G114: 8 | H114: 10 | I114: 8 | J114: 10 | K114: 8 | L114: =SUM(E114:K114) -> 44
A115: 3 | B115: Pētersone Vineta | D115: 1999 | E115: 10 | G115: 10 | K115: 10 | L115: =SUM(E115:K115) -> 30
A116: 4 | B116: Krasts Artūrs | C116: Smiltene | D116: 2000 | F116: 6 | G116: 5 | I116: 5 | K116: 6 | L116: =SUM(E116:K116) -> 22
A117: 5 | B117: Vimba Rūdolfs Matīss | C117: Valmiera | D117: 2000 | E117: 6 | G117: 6 | J117: 6 | K117: 3 | L117: =SUM(E117:K117) -> 21
A118: 6 | B118: Āre Atis | D118: 2000 | G118: 2 | I118: 6 | J118: 5 | K118: 5 | L118: =SUM(E118:K118) -> 18
A119: 7 | B119: Ratniece Marta | C119: Riteņu vasara | D119: 2000 | E119: 5 | F119: 1 | H119: 5 | K119: 1 | L119: =SUM(E119:K119) -> 12
A120: 8 | B120: Velps Matīss | C120: 4 sekundes | D120: 1999 | F120: 10 | L120: =SUM(E120:K120) -> 10
A121: 9 | B121: Eliass Martins | C121: Dod ručkā | D121: 2000 | E121: 4 | F121: 3 | G121: 3 | L121: =SUM(E121:K121) -> 10
A122: 10 | B122: Rūsiņš Kristiāns | C122: Toyota team | D122: 2000 | E122: 2 | H122: 6 | I122: 1 | L122: =SUM(E122:K122) -> 9
A123: 11 | B123: Katena Dagnija | D123: 2000 | E123: 1 | H123: 3 | I123: 3 | J123: 2 | L123: =SUM(E123:K123) -> 9
A124: 12 | B124: Šnē Ivo | C124: 4 sekundes | D124: 1999 | F124: 5 | L124: =SUM(E124:K124) -> 5
A125: 13 | B125: Bļizņuks Aleksandrs | C125: RRS Baloži | D125: 1999 | F125: 4 | L125: =SUM(E125:K125) -> 4
A126: 14 | B126: Belevičs Jēkabs | D126: 2000 | H126: 4 | L126: =SUM(E126:K126) -> 4
A127: 15 | B127: Vērdiņš Gints | D127: 1999 | I127: 4 | L127: =SUM(E127:K127) -> 4
A128: 16 | B128: Fūrmanis Āris | D128: 2000 | J128: 4 | L128: =SUM(E128:K128) -> 4
A129: 17 | B129: Parijuks Kristiāns | E129: 3 | L129: =SUM(E129:K129) -> 3
A130: 18 | B130: Prokofjeva Linda | D130: 2000 | G130: 1 | H130: 2 | L130: =SUM(E130:K130) -> 3
A131: 19 | B131: Tipāns Ēriks Gustavs | D131: 1999 | J131: 3 | L131: =SUM(E131:K131) -> 3
A132: 20 | B132: Iļjenko Mārtiņš Andrejs | C132: Rīgas Teikas vsk. | D132: 2000 | F132: 2 | L132: =SUM(E132:K132) -> 2
A133: 21 | B133: Piļicka Ingija Laine | D133: 1999 | I133: 2 | L133: =SUM(E133:K133) -> 2
A134: 22 | B134: Skripsts Raivis | D134: 2000 | K134: 2 | L134: =SUM(E134:K134) -> 2
A135: 23 | B135: Gajevskis Artjoms | D135: 2000 | J135: 1 | L135: =SUM(E135:K135) -> 1